page,paragraph_id,sentence_num,sentence_text
62,421,3,Han kan härigenom få för det övriga skolarbetet nya och betydelsefulla synpunkter på eleverna och deras individuella behandling
62,422,1,"Vad beträffar friluftsverksamhetens planering och innehåll hänvisas till särskilda anvisningar, utfärdade av SO"
62,422,2,"Allmänt bör beaktas, att friluftstimmarna skall disponeras för aktiviteter utomhus"
62,422,3,"Speciellt bör de huvudmoment, som ej kan bedrivas på schemabunden tid behandlas"
62,422,4,"Under friluftsverksamhet ges en naturlig tillämpning av sådana moment som tex allemansrätten, naturvård och naturskydd"
62,423,1,Lägerskolverksamhet Vid lägerskolverksamhet får elever i samband med internatförläggning under ett par dagar eller vanligen omkring en vecka genomföra i förväg planerade studier av naturen och människornas liv och verksamhet på en annan plats än skolorten
62,423,2,Verksamheten utgör sålunda en del av den reguljära undervisningen och innebär ett värdefullt komplement till denna
62,423,3,I regel har lägerskolverksamhet hittills anordnats huvudsakligen för elever i årskurserna på högstadiet och i mellanstadiets avslutande årskurser
62,423,4,Er68 | Undervisning
62,423,5,Undervisningsformer och arbetsätt
63,424,1,Studiernas uppläggning och inriktning
63,425,1,"farenheter har emellertid gett vid handen, att även yngre elever kan delta med god behållning"
63,425,2,"Det är därför värdefullt, om denna verksamhetsform i skolarbetet kan introduceras successivt med början på lågstadiet"
63,425,3,Redan under slutet av detta stadium bör det vara möjligt att låta en heldagsutflykt utvecklas till två exkursionsdagar med en mellanliggande övernattning
63,426,1,Lägerskolverksamheten behöver inte nödvändigtvis förläggas särskilt långt borta från skolorten
63,426,2,"Tvärtom är det angeläget, att inte alltför stor del av den anslagna tiden går åt till transporter"
63,426,3,"Det är emellertid väsentligt, att eleverna får möta natur och bygd av annat slag än de är vana vid, men denna synpunkt kan vanligtvis beaktas inom något tiotal mils avstånd från skolorten"
63,426,4,"Allmänt kan också sägas, att en ursprunglig bygd med måttligt komplicerade former för människornas individuella och gemensamma liv och arbete och en så långt möjligt orörd natur är att föredra framför allfarvägar och turistcentra, även om lägerskolverksamheten på en sådan ort skulle innebära enklare förläggnings- och arbetsförhållanden"
63,427,1,Av många skäl är höst och vår den lämpligaste tidpunkten för lägerskolverksamhet i vårt land
63,427,2,Även möjligheten att förlägga den till vintern bör emellertid beaktas
63,427,3,Arbetslivet och den kulturella verksamheten i en bygd kan vanligen utan större olägenhet studeras oberoende av årstiden
63,427,4,"Livsyttringarna i naturen är visserligen mindre påtagliga under vintern, men de är fördenskull inte mindre intressanta"
63,427,5,"Speciellt om eleverna tidigare varit med om lägerskolverksamhet under en viss vegetationsperiod, kan det finnas skäl att med hänsyn till undervisningens syfte och elevernas intresse allvarligt överväga, om inte en annan årstid vore lämpligare för en upprepad lägerskolvistelse"
63,428,1,Arbetet vid en lägerskola bör förberedas gemensamt av eleverna och medverkande lärare och annan personal
63,428,2,"Lägerskolverksamheten bör planeras och genomföras så, att eleverna får tillfälle att under hela vistelsen sörja för sin egen livsföring och trivsel"
63,428,3,Arbete i grupper bör vara den vanligaste arbetsformen
63,428,4,Möjligheterna att skaffa sig erfarenheter från olika miljöer utanför skolan och hemmet bör utnyttjas liksom möjligheterna till att umgås med andra människor
63,428,5,"Studierna, som centreras kring de konkreta studieobjekten, bör ge eleverna möjligheter att mera självständigt och under friare former göra iakttagelser, samla och värdera resultat"
63,428,6,De bör ge eleverna tillfälle att på ett konkret sätt uppleva sambandet mellan företeelser i naturen och i människolivet
63,429,1,"Ett väsentligt värde i en väl genomförd lägerskolverksamhet ligger däri, att den genom grupparbete och kamratlig samvaro skapar en naturlig samhörighet mellan alla deltagare och på så sätt ger ovärderliga erfarenheter för det fortsatta skolarbetet"
63,429,2,"Upplevelsen av ett gemensamt ansvar för varandra och för arbetet kan ytterligare förstärkas genom att lägerskolverksamheten på planeringsstadiet blir föremål för öppna diskussioner kring önskvärd, lämplig och realiserbar uppläggning"
63,429,3,! samband därmed är föräldrarnas medverkan både önskvärd och värdefull
63,430,1,Huvuddelen av det med skolan förbundna arbetet skall eleven utföra på skoltid
63,430,2,Lektionerna skall användas för aktiv inlärning
63,430,3,"Detta gäller såväl inlärning av allmänorienterande stoff som färdighetsträning i läsning, skrivning, räkning och främmande språk"
63,430,4,Eleverna bör få individuell handUndervisning
63,430,5,Undervisningsformer och arbetsätt69 ledning i skolan i naturliga arbetssituationer och med tillgång till lämpliga läromedel
63,430,6,Vidare bör eleverna få möjlighet att diskutera avsikten med olika studieuppgifter och hur man kan kontrollera att syftet uppnåtts
63,430,7,"När arbetet omfattar större arbetsområden, där redovisning och utvärdering avses ske i ett sammanhang, bör studierna följas särskilt noga av läraren, så att han kan lämna erforderlig hjälp med planeringen av arbetet och tillse att onödigt pressande memorerings- och redovisningssituationer inte uppkommer"
64,432,1,| detta studiearbete är det viktigt att läraren tar hänsyn till variationerna i elevgruppen
64,432,2,Det är orimligt att kräva samma arbetsprestation av alla elever
64,432,3,"Arbetet i skolan skall innebära en målmedveten strävan från lärarens sida att tillsammans med eleven grundlägga och vidareutveckla den individuella förmågan att studera på egen hand och tillsammans med andra, att utnyttja olika kunskapskällor, att planera ett arbete och genomföra det på ett effektivt och tidsbesparande sätt och att ta initiativ till kompletterande och fördjupande studier och andra sysselsättningar i skolan och under fritiden"
64,433,1,Råd och övning i studieteknik utgör i detta sammanhang betydelsefulla inslag i arbetet
64,433,2,"Läsundervisningen bör syfta till att grundlägga en god lästeknik, så att eleverna självständigt och på kort tid samt med god förståelse hämtar information ur texten"
64,433,3,En sådan lästräning bör ingå i undervisningen i alla ämnen
64,433,4,"Eleverna är främst betjänta av ett gott ordförråd, så att de inte hindras av att inte förstå enskilda ord"
64,433,5,De bör också få öva sig i att finna det väsentliga i en text samt att ordna upp och överblicka lärostoffet
64,433,6,"Vidare bör de lära sig att anpassa läsningen efter textens koncentrationsgrad och syfte, så att de ser, vad som kan hastigt ögnas igenom och vad som kräver noggrannhet och eftertanke"
64,433,7,"Väsentligt är också, att de lär sig att använda innehållsförteckningar, register och sammanfattningar"
64,433,8,"Vidare måste de bibringas vana att avläsa bildmaterial, tabeller och diagram, vilka ofta meddelar sitt innehåll snabbare och mer nyanserat än texten"
64,433,9,Efter hand bör eleverna därvid få utveckla sin förmåga att självständigt värdera olika slags bilder
64,434,1,Lästeknisk träning och rådgivning av denna art kan man börja med redan på lågstadiet för att sedan utöka och precisera den
64,434,2,"Till träningen bör också fogas anvisningar om hur man gör understrykningar, anteckningar, sammandrag och repetitioner"
64,434,3,"Betydelsen av att man är utvilad bör framhållas, liksom av att man gör pauser och söker omväxling"
64,434,4,Studie- och inlärningstekniken måste anpassas till det aktuella stoffet
64,434,5,"Är detta av mera mekanisk och registrerande art, bör inlärningen fördelas på kortare pass med pauser emellan"
64,434,6,"Rör det sig om logiskt sammanhängande och meningsfullt stoff, kan man däremot vinna på att läsa utan avbrott"
64,435,1,En inlärning kan ske enligt helhetsmetod eller delmetod
64,435,2,"Den förra innebär, att man upprepade gånger läser texten i dess helhet, tills man behärskar den, den senare, att man styckar den och läser varje del upprepat"
64,436,1,"Ofta torde eleven vara betjänt av att även föräldrarna, då så kan ske, får studieteknisk information och uppslag till hur skolarbetet kan kompletteras och berikas genom fritidssysselsättningar av olika slag"
64,437,1,Med en sådan inriktning av arbetet i skolan blir traditionella hemuppgifter för eleverna av underordnad betydelse
64,437,2,"Detta är också väl motiverat på grund av det förhållandet, att man i timplanerna fastställt ett så stort veckotimtal för elevernas undervisning i skolan, att de bör få använda övrig tid"
64,438,1,70 | Undervisning
64,438,2,Undervisningsformer och arbetssätt
65,439,1,Utvärdering varje dag för rekreation
65,439,2,Hemuppgifter bör följaktligen i största möjliga utsträckning vara frivilliga för eleverna
65,439,3,Skolledningen har ett ansvar för att detta också blir förverkligat
65,439,4,De frivilliga hemuppgifterna kan innebära såväl individuella åtaganden som gruppåtaganden
65,439,5,De förra behöver inte genomgående avse bokliga studier med inlärning av vissa fakta och övning av färdigheter
65,439,6,"De kan också bestå av iakttagelser, referat av dagsaktualiteter, beskrivningar av miljöer, uppföljning och redovisning av händelser, underhållningsprogram, förevisningar, utställningar etc"
65,439,7,"De senare kan bestå i att en grupp genomför en intervju, ett studiebesök eller samlar in studiematerial för fortsatt arbete i skolan"
65,440,1,Utvärdering i undervisningssammanhang (evaluering) avser en kontroll av undervisningens resultat i relation till uppställda mål
65,440,2,Utvärderingens främsta syfte är att klargöra om undervisningssätt och läromedel varit väl valda och om målet varit realistiskt
65,440,3,Den är inte nödvändigtvis ett led i betygsättning av eleverna
65,441,1,"En utvärdering kan ske i relation till ett preciserat och specificerat mål, tex ett på förhand bestämt kunskapsmått, så långt möjligt angivet i absoluta termer"
65,441,2,Detta slag av utvärdering sägs vara målrelaterad
65,441,3,"Ett annat slag är vad man kallar normrelaterad och innebär, att den enskilde elevens resultat bedöms i relation till resultaten inom den elevgrupp som eleven tillhör, tex en årskurs"
65,441,4,Man kan vidare tala om en individrelaterad utvärdering
65,441,5,Den innebär att elevens framsteg och svårigheter bedöms i relation till motsvarande prestationer vid en bestämd tidigare tidpunkt och till de förutsättningar i vidaste mening som eleven bedöms ha vid utvärderingstillfället
65,441,6,"Eftersom det yttersta syftet med undervisningen i grundskolan är den enskilde elevens optimala personlighetsutveckling, måste den individrelaterade utvärderingen ägnas speciellt intresse"
65,442,1,Åtskilliga problem i samband med utvärderingar består i svårigheter att på ett tillfredsställande sätt precisera mål och förutsättningar för undervisningen
65,442,2,Utvärderingen kan ofta komma att göras i nära anslutning till vad den direkta undervisningen avhandlat och inte med hänsyn till det uppsatta målet
65,442,3,Man prövar vidare ofta vad som är lätt att pröva men avstår från att söka kontrollera mera svårmätta funktioner
65,442,4,Skrivningar och frågor av verbal karaktär får sålunda ofta ett otillbörligt utrymme i utvärderingen
65,442,5,"De bör kompletteras av andra utvärderingssätt, tex skattningar, rangordningar och bedömningar, även med risk att subjektiviteten får ökat inslag"
65,443,1,"Dessa vanliga fel vid utvärderingar av elevernas resultat har medfört, att kunskaper och färdigheter i skolans ämnen (kognitiva funktioner av undervisningen) blivit det alltigenom dominerande i utvärderingen och att man ofta bortsett från andra klart uttalade syften med undervisningen"
65,443,2,"Av samma skäl har även inom det kognitiva fältet otillbörlig vikt fästs vid reproducerbara faktakunskaper, medan utvärderingen mindre gällt tilllämpningen och användningen av kunskaperna"
65,444,1,"En utvärdering, som mera allsidigt ansluter till skolans och undervisningens mål, bör avse följande funktioner:"
65,445,1,kognitiva funktioner elevens förmåga att förvärva och tillämpa kunskaper och färdigheter i skolans ämnen
65,446,1,Undervisning
65,446,2,Undervisningsformer och arbetssätt | 7 manuella funktioner elevens förmåga och färdighet i manuellt arbete och kroppsarbete emotionella funktioner elevens uttryck för känslo- och viljemässig mognad estetiska funktioner elevens förmåga att uppleva och uttrycka estetiska värden fysiska funktioner elevens fysiska och fysiologiska anpassning till yttre livsbetingelser sociala funktioner elevens uttryck för delaktighet i en gemenskap och förmåga att samarbeta
66,448,1,"Elevens resultat bör så långt möjligt utvärderas inom vart och ett av dessa målområden, varvid det gäller att avgöra vad som är bättre eller sämre resultat och att fortlöpande följa resultatutvecklingen från enkla och mera osjälvständiga resultat till mera avancerade uttryck för tillämpning och skapande förmåga"
66,449,1,Uppdelningen på dessa målfunktioner gör inte anspråk på att vara vare sig fullständig eller slutgiltig
66,449,2,"Den avser huvudsakligen att utgöra upptakten till ett målmedvetet arbete på att något mera precisera och systematisera utvärderingen, dvs slutfasen i undervisningsprocessen"
66,449,3,"Detta i sin tur förutsätter att man redan i inledningsfasen analyserat och preciserat målet, vilket leder till att övriga förutsättningar för undervisningen och undervisningssättet måste preciseras och systematiseras på samma sätt"
66,449,4,Utpekandet av en rad målfunktioner vid sidan av de hävdvunna kognitiva funktionerna blir en ständig påminnelse om mångfalden i skolans uppgifter
66,449,5,"Bedömningen av lärostoff, läromedel, undervisningsformer, arbetssätt och utvärderingsformer måste ske med denna breddade och preciserade måldefinition i sikte"
66,449,6,"Det kan också konstateras, att den enskilde läraren, oavsett i vilket ämne han undervisar, har del i ansvaret för elevens utveckling i kognitivt, manuellt, emotionellt, estetiskt, fysiskt och socialt hänseende"
66,449,7,De olika målfunktionerna har emellertid olika tyngd i olika skolämnen
66,449,8,Inget ämne har ensamrätt till någon målfunktion
66,449,9,Normalt står heller inte något skolämne helt utanför någon av de angivna målfunktionerna
66,450,1,"Om den enskilde läraren sålunda har att allsidigt bedöma sina elever, så torde man inte kunna begära, att hans enskilda utvärdering skall vara alltigenom ensamrådande och giltig"
66,450,2,Det krävs därför ett lagarbete av de lärare som undervisar eleven
66,450,3,"I det lärarlag, som bildar t ex klasskonferensen eller årskurskonferensen, behövs medverkan av specialister inom enskilda ämnen, i fråga om enskilda undervisningsprocesser och i fråga om den elevvårdande verksamheten"
66,450,4,En sådan samverkan ökar tillförlitligheten i utvärderingen
66,450,5,Vidare fordras för ett tillfredsställande resultat av utvärderingen en vidareutveckling av den nuvarande pedagogiska mättekniken
66,450,6,"Slutligen behöver man också i vissa fall klarlägga vissa värderingar i målskrivningarna, tex i kvalitetsfrågor inom den estetiska målfunktionen"
66,451,1,Svårmätta är förvisso resultaten av utvärderingar inom de emotionella och sociala målområdena liksom inom högre nivåer av kognitiva målfunktioner
66,451,2,"Inom de manuella och fysiska målfunktionerna har man däremot stora möjligheter att göra målrelaterade utvärderingar, ofta i absoluta termer av typ per prestationsenhet, prestation per tidsenhet eller absolut prestation"
66,452,1,72 | Undervisning
66,452,2,Undervisningsformer och arbetssätt
67,453,1,Undervisning i klasstyp b och B
67,454,1,Planering
67,455,1,Här bör emellertid varnas för överdrivna krav på tillförlitliga mätningar i utvärderingssammanhang
67,455,2,Ett inslag av subjektivitet i vissa utvärderingar är oftast mindre ödesdigert än ett slopande av vissa obekväma utvärderingskrav
67,455,3,"Mäter man enbart det lätt mätbara, reduceras skolans mål åter till väsentligen enkla kognitiva minnesfunktioner med därav följande teoretisering och faktaplugg"
67,456,1,Slutligen bör understrykas att utvärdering i olika former är av minst lika stort värde för skolan själv och för läraren som för eleven och hemmet
67,456,2,"Genom evalueringen får skolan information om huruvida dess funktion och verksamhet på ett riktigt sätt svarar mot det uppställda målet, elevernas förutsättningar och pedagogikens utveckling"
67,457,1,Vad som ovan sagts om undervisningsformer och arbetssätt gäller alla klasstyper
67,457,2,Verksamheten i klasser av b- och B-typ skiljer sig inte med nödvändighet från motsvarande i klasser av a- och A-typ
67,457,3,"Eftersom b- och B-klasserna omfattar två eller flera årskurser, som undervisas samtidigt, blir en väl planerad individualiserad undervisning särskilt nödvändig"
67,457,4,De i timplanerna angivna resurstimmarna används för undervisning av grupper eller enskilda elever
67,457,5,"Genom samverkande undervisning av två eller flera lärare, kan man undvika att arbetsdagen för eleverna förlängs"
67,458,1,"Arbetsresultatet i en klass av b- och B-typ är i högsta grad beroende av hur läsårets, terminens, veckans och dagens arbete organiseras"
67,458,2,"Lärostoffet måste ordnas på ett sätt, som underlättar och effektiviserar arbetet"
67,458,3,Underlag för denna planering av arbetet är de för lågstadiet och mellanstadiet gällande huvudmomenten
67,458,4,I tillämpliga delar gäller för årskurs 4 av klasstyp B1 och B2 även huvudmomenten för lågstadiet i hembygdskunskap och för årskurs 3 av samma klasstyper även huvudmomenten i orienteringsämnen för mellanstadiet
67,459,1,"När lärostoffets art så medger, är det lämpligt att alla årskurser i en beller B-klass undervisas gemensamt"
67,459,2,"Genom en väl genomtänkt kursplanering kan sådan samundervisning ordnas varje läsår både inom moment, som återkommer i alla årskurser, och inom sådana, som utan olägenhet kan placeras i vilken årskurs som helst"
67,459,3,Dessa senare kan vid behov fördelas på tre eller fyra i stället för på två år
67,459,4,"Det är angeläget, att noggrannhet iakttas vid fördelningen på olika läsår av huvudmoment i ämnen, där sådan samundervisning sker"
67,460,1,Som exempel på gemensam undervisning av detta slag kan följande nämnas
67,460,2,I religionskunskap kan samundervisning ske vid behandlingen av valda berättelser ur gamla och nya testamentet och vid samtal i samlevnadsfrågor
67,460,3,"I samhällskunskap och naturkunskap utgör exkursioner och studiebesök samt bearbetning av uppgifter, som därvid aktualiserats, lämpliga gemensamma undervisningsmoment"
67,460,4,I historia och geografi kan gemensam undervisning av andra än närmast på varandra följande årskurser endast mera tillfälligt förekomma
67,460,5,"Matematiktimmarna är till större delen gemensamma, men eleverna i de olika årskurserna fullgör vanligen skilda uppgifter"
67,460,6,Undervisningen i estetisk-praktiska ämnen och gymnastik kan i stor utsträckning vara gemensam
67,460,7,"Särskilt är detta lämpligt i sådana ämnen, där eleverna huvudsakligen arbetar individuellt och i sin egen arbetstakt, tex i slöjd och teckning"
67,461,1,Undervisning
67,461,2,Undervisning i klasstyp b och B | 73
68,462,1,Kursplaneringen i orienteringsämnen sker inom ramen för lågstadiets och mellanstadiets huvudmoment i respektive ämnen och med beaktande av anvisningarna om lärostoffets gruppering och inordnande i en lärogång som i möjligaste mån tillgodoser kravet på sammanhang och progression i undervisningen genom årskurserna 1—6
68,462,2,Samverkan i planeringen är därför nödvändig mellan avlämnande och mottagande lärare i dessa årskurser
68,462,3,För årskurserna 1—4 sker planeringen inom ramen för lågstadiets huvudmoment med tillägg av valda huvudmoment för mellanstadiet
68,462,4,För årskurserna 5—6 sker planeringen inom ramen för återstående huvudmoment för mellanstadiet
68,462,5,Förslag till fördelning av mellanstadiets huvudmoment på årskurs 4 respektive årskurserna 5 och 6 anges i supplement för orienteringsämnen på mellanstadiet
68,462,6,Kursplaneringen i orienteringsämnen måste sålunda omspänna minst två läsår
68,463,1,"Innehåller en klass två på varandra följande årskurser, exempelvis i skolor av klasstyp b och B1 årskurserna 1—2, 3—4 eller 5—6, kan en tvåårig kursplanering ske på bla följande två sätt:"
68,464,1,"a Ena året behandlas de huvudmoment, som föreslagits för den lägre årskursen, andra året de som föreslagits för den högre"
68,464,2,"Under läsår, då de huvudmoment behandlas, som föreslagits för den högre årskursen, bör inledande återblickar förekomma för att sammanfatta och aktualisera det väsentligaste i föregående års arbetsprogram, i den mån sådana inslag i undervisningen erfordras som ett underlag för studierna"
68,464,3,"Dessa sammanfattande och inledande moment placeras tex i början av läsåret eller när den första perioden i vederbörande ämne påbörjas, beroende på om samlad undervisning eller periodläsning tillämpas"
68,464,4,Under både ena året och andra året måste i årskurserna 3 och 4 behandlas såväl huvudmoment ur hembygdskunskap som huvudmoment ur mellanstadiets orienteringsämnen
68,464,5,Planeringen bör därvid ske i nära anslutning till den lokala studieplanen i hembygdskunskap
68,465,1,b Alla väsentliga huvudmoment i det tvååriga kursprogrammet behandlas årligen
68,465,2,"Huvudmoment, som behandlas ingående under ena året, behandlas översiktligt under andra året"
68,465,3,"De översiktliga inslagen kan vara av inledande, sammanbindande och sammanfattande karaktär"
68,465,4,"De skall vara så beskaffade, att de bidrar till att skapa kontinuitet i lärogången"
68,466,1,"Exempel på olika lösningar av kursplaneringsfrågor, bl a ett utförligt förslag till planering enligt alternativ b ovan, finns i särskilt supplement för undervisningen i klasstyp b och B"
68,466,2,Även andra sätt att planera undervisningen kan med fördel tillämpas
68,467,1,I klass av B2-typ kan i regel tillämpas samma anordningar beträffande huvudmomentens placering som ovan angivits för klass av B1-typ
68,467,2,"Gemensam undervisning av alla årskurser kan lämpligen ske i valda huvudmoment inom exempelvis religionskunskap, samhällskunskap och naturkunskap"
68,467,3,"Arbetet organiseras emellertid oftast lämpligen i två grupper, den ena omfattande tredje och fjärde årskurserna, den andra femte och sjätte årskurserna"
68,467,4,"För att sådan gruppundervisning skall ge avsedda resultat, krävs emellertid en noggrann planering och andra förberedande åtgärder, så att ena gruppen kan utföra ett meningsfullt arbete på egen hand, medan den andra gruppen får direkt handledning av läraren"
68,468,1,"Studiegången i avvikande klasstyp med tre årskurser (1, 3 och 5 respektive 2, 4 och 6) kan i stort sett läggas upp med ledning av lågstadiets och"
68,469,1,14 | Undervisning
68,469,2,Undervisning i klasstyp b och B
69,470,1,Det dagliga arbetet
69,471,1,Specialundervisning
69,472,1,"Allmänna förutsättningar mellanstadiets huvudmoment med tillämpning av en ändamålsenlig växling mellan å ena sidan undervisning av alla årskurser och å andra sidan arbete organiserat i tre grupper, var och en omfattande en årskurs"
69,472,2,"I denna klasstyp är det emellertid särskilt angeläget, att undervisningen anpassas efter de enskilda elevernas förutsättningar och arbetstakt"
69,473,1,Vid den kontinuerliga planeringen under läsåret förbereds även elevernas självständiga arbete
69,473,2,"För att eleverna skall kunna få tillfälle att i tillräcklig omfattning och i aktuella sammanhang arbeta på egen hand och ta egna initiativ, måste läraren se till, att de får kännedom om tillgängliga läromedel och lär sig bästa sättet att utnyttja dem"
69,473,3,De bör instrueras om hur man använder skolans läromedelsförteckningar och arbetsuppgifter av olika slag för självständiga studier
69,473,4,"Därvid bör observeras, att tryckt material för arbetet i flerklassiga skolor inte helt kan ersätta sådant material som läraren själv utarbetar med hänsyn till den aktuella undervisningssituationen och de lokala förhållandena"
69,474,1,"Det dagliga arbetet bör planeras periodvis, exempelvis för en vecka i taget"
69,474,2,En sådan arbetsplan bör innehålla anteckningar om varje grupps sysselsättning under olika arbetspass
69,474,3,De olika grupperna kan arbeta med skilda ämnen eller samma ämne
69,474,4,"Används klassens resurstimmar för samverkan med andra lärare, måste denna verksamhet planeras av lärarna gemensamt"
69,475,1,Gemensam tid kan anslås på schemat för ett ämne även då samundervisning inte förekommer
69,475,2,De olika årskurserna eller grupperna arbetar då med skilda uppgifter
69,475,3,I regel förekommer dock i varje arbetspass inslag av självständig elevaktivitet
69,475,4,Detta arbete är ett viktigt led i kunskapsinhämtandet och färdighetsträningen
