page,paragraph_id,sentence_num,sentence_text
171,1728,5,"Skolan själv tar nämligen inte ställning, men eleverna skall kunna ta ståndpunkt"
171,1728,6,"Samma princip gäller i fråga om behandlingen av alla dokument som studeras med avseende på kristendomen, övriga religioner och icke-religiösa livsuppfattningar"
171,1728,7,De
171,1729,1,12 — Läroplan
171,1729,2,"Allmän del måste så vitt möjligt belysas inifrån, förklaras och diskuteras"
171,1730,1,Med en sådan uppläggning av arbetet tillgodoses lättare kravet på objektivitet och frågan om engagemang och påverkan kommer in i ett naturligt konstruktivt sammanhang
171,1730,2,Genom att för eleverna väsentliga frågor tas upp till behandling tillförsäkras elevengagemanget en fundamental roll
171,1730,3,"Arbetet låter eleverna få kontakt med dokument, livsideal och värderingar som kan ha betydelse för deras personliga utveckling, skapa respekt för oliktänkande och hjälpa dem själva fram till en personlig livsuppfattning"
171,1730,4,Det kan också öka deras vilja till insats i medmänskliga sammanhang
171,1730,5,Grundläggande etiska krav kommer då inte av eleverna att uppfattas som godtyckligt givna utan som framvuxna ur samlevnadens villkor
171,1731,1,Arbetssätt och läromedel
171,1732,1,"Eleverna bör orientera sig i frågor kring livsåskådning, tro och etik så långt möjligt genom aktivt arbete"
171,1732,2,Därvid skall eleverna uppöva sin förmåga att på egen hand hämta information ur lämpliga kunskapskällor
171,1733,1,Studiet i religionskunskap ger särskild anledning att arbeta med urkunder av olika slag
171,1733,2,"De religiösa urkunderna, i första hand bibeln, spelar här en framträdande roll"
171,1733,3,"För att bibelns innehåll skall bli tillgängligt för eleverna, är det ofta nödvändigt att på de lägre stadierna använda texttrogna översättningar med ett betydligt enklare språk än den officiella bibelöversättningens"
171,1733,4,"Med denna bör eleverna dock få göra omedelbar bekantskap, så snart deras läsfärdighet tillåter"
171,1733,5,Biblar bör finnas i tillräckligt antal för individuellt bruk i undervisningen från och med årskurs 3
171,1733,6,På högstadiet skall eleverna stifta bekantskap med utdrag ur andra religioners urkunder
171,1734,1,Psalmer och andra religiösa sånger såväl som böner kan förmedla ett direkt intryck av både enskilda människors och religiösa riktningars andakts- och gudstjänstliv
171,1734,2,Vid psalmoch sångvalet bör man i regel ta hänsyn även till melodierna och dessa bör om möjligt inläras samtidigt som texten behandlas
171,1735,1,Övriga för undervisningen aktuella dokument är inte lika lättåtkomliga som bibel och de olika kristna samfundens psalmböcker
171,1735,2,Många religiösa dokument eller delar därav är dock utgivna som fickböcker och i antologier
171,1735,3,Detta gäller också dokument beträffande de icke-religiösa livsåskådningarna
171,1736,1,"Television, radio, dagstidningar och tidskrifter är nödvändiga hjälpmedel i arbetet"
171,1736,2,De utgör ett värdefullt underlag för undervisningen kring sådana frågor som är angelägna och aktuella för eleverna
171,1737,1,Möjlighet till olika slag av studiebesök bör utnyttjas
171,1737,2,"Sådana besök i kyrkor och andra gudstjänstrum bör så långt möjligt ske, när dessa är I funktion"
171,1737,3,"Det är nämligen inte kyrkan som lokal, som bör vara det egentliga föremålet för studierna, utan kyrkan som gudstjänstrum"
171,1737,4,Helst bör någon form av gudstjänst förekomma eller anordnas i samband med besöket
171,1738,1,Inslag av religiös andakt i olika utformning i morgonsamlingarna kan också förmedla något av religionens upplevelsesida
171,1739,1,Orienteringsämnen
171,1739,2,Religionskunskap 177
172,1740,1,Hembygdskunskap
172,1741,1,MÅL
172,1742,1,"Undervisningen i hembygdskunskap har till uppgift att orientera eleverna i omgivningen, ge dem kunskap om ting och förhållanden, som deras intresse inriktar sig på under de första skolåren, samt vidga deras föreställningskrets"
172,1742,2,"Den bör därvid söka belysa hur människor lever och verkar tillsammans, väcka elevernas intresse för naturen och hjälpa dem att se samspelet mellan allt som lever"
172,1742,3,"I största möjliga utsträckning skall den utgå från elevernas egna iakttagelser, upplevelser och problem samt tillvarata deras lust att upptäcka, fråga och undra"
172,1742,4,Den bör ge dem rika möjligheter att i fri skapande verksamhet finna uttryck för sina tankar och känslor och att låta dem söka gestalta sina erfarenheter allt efter individuell förmåga
172,1743,1,Undervisningen i hembygdskunskap avser sålunda både samhällsorientering och naturorientering
172,1743,2,Den bör inriktas på att ge eleverna en god intressegrund för kommande studier inom ämnen och ämnesgrupper med motsvarande syfte
172,1743,3,Undervisningen bör vidare ge dem övning i att utnyttja enkelt studie- och arbetsmaterial för att självständigt förvärva kunskap
172,1744,1,HUVUDMOMENT
172,1745,1,"Hem, skola och samhälle: Orientering inom skolans lokaler och kontakt med alla som arbetar där"
172,1745,2,"Några enkla ordningsregler, som aktualiseras under samvaro och samtal med barnen"
172,1745,3,"Aktuella trivsel- och samlevnadsproblem, t ex hänsyn, ansvar och hjälpsamhet"
172,1745,4,Hemmet och familjen
172,1745,5,Något om samverkan och människors beroende av varandra
172,1745,6,Faror och skydd i barnens omgivning
172,1745,7,"Om hjälp och förmåner i hem, skola och samhälle"
172,1746,1,"Helger och festdagar: Årets helger samt några högtidsdagar, tex svenska flaggans dag"
172,1746,2,Nordens dag och FN-dagen
172,1746,3,Något om traditioner och helgseder hemma och i andra länder
172,1746,4,Traditioner i skolan
172,1747,1,Vår hälsa: Samtal om människokroppen och dess vård samt om betydelsen av goda hälsovanor
172,1747,2,Några viktiga hälsoregler
172,1747,3,Något om hälsovård och
172,1748,1,178 | Orienteringsämnen
172,1748,2,"Hembygdskunskap sjukvård i hem, skola och samhälle"
172,1748,3,Något om tobak och alkohol
172,1749,1,Sexualundervisning: Samtal i för barnen naturliga sammanhang
172,1750,1,I trafiken: Säkerhetssynpunkter på barnens färd till och från skolan
172,1750,2,"Trafikmärken och trafikregler, som är aktuella för bygden"
172,1750,3,Ansvar och hänsyn i trafiken
172,1750,4,Polisen ger hjälp
172,1750,5,Samfärdsel och samfärdsmedel
172,1751,1,I hembygden: Bebyggelse och arbetsliv i närsamhället
172,1751,2,Traktens terrängförhållanden
172,1751,3,Väderstrecken
172,1751,4,Enkla kartor och aktuella geografiska begrepp
172,1751,5,"Studium huvudsakligen av miljöbilder från natur och arbetsliv i en vidare hemtrakt, tex ett naturligt geografiskt område"
172,1752,1,Förr i världen: I hembygden förr och nu
172,1752,2,Historiska minnen och sägner från hembygden
172,1752,3,Några miljöbilder från forntidens svenska historia
172,1753,1,Växter och djur: Fortlöpande naturiakttagelser
172,1753,2,Exkursioner för att iaktta några vanliga växter och djur i skolans närhet och i några av hemtraktens vanligaste naturtyper
172,1753,3,Några husdjur
172,1753,4,Naturen ger oss föda
172,1753,5,Naturvård och djurskydd
172,1753,6,Enkla odlingsförsök
172,1754,1,Tid och väderlek: Årets indelning
172,1754,2,"Något om jorden, solen, månen och några stjärnbilder"
172,1754,3,Klockan
172,1754,4,Något om almanackan
172,1754,5,Termometern
172,1754,6,Fortlöpande väderleksiakttagelser
172,1754,7,Enkla diagram över hemtraktens väderleksförhållanden
172,1755,1,Varor och andra ekonomiska värden: Olika slag av butiker
172,1755,2,Vägning och mätning
172,1755,3,Köp och betalning
172,1755,4,"Något om råvaror, tex i våra kläder och matvaror"
172,1755,5,"Ekonomisk fostran, bla hur man bör akta och vårda egen, andras och allmän egendom"
172,1756,1,Teknik i vardagslivet: Samtal i anslutning till iakttagelser och erfarenheter samt enkla undersökningar och försök i för barnen naturliga sammanhang
172,1757,1,Ute i världen: Något om människor och förhållanden i ffrämmande miljöer
172,1757,2,Något om kontakt och utbyte mellan olika folk
172,1757,3,Internationell förståelse
172,1758,1,"Aktuellt stoff, som motiveras av tex händelser och företeelser, barnens speciella intressen, arbetet i klassrummet, studiebesök och exkursioner"
172,1759,1,Teckning och annat manuellt arbete: Fritt ska-
172,1759,2,pande arbete för att tillgodose elevernas uttrycksbehov
172,1759,3,"Teckning, målning och framställning av föremål av skilda material i anslutning till övrig undervisning i hembygdskunskap"
172,1759,4,"Visning av och samtal om elevernas egna arbeten samt om konst och konsthantverk lakttagelseövningar, bla i fråga om färg och form"
172,1759,5,Olika aktiviteter i avsikt att skapa en trivsam miljö
172,1759,6,(Se även huvudmoment under ämnesrubrikerna Teckning och Slöjd
172,1759,7,)
173,1761,1,ANVISNINGAR OCH KOMMENTARER
173,1762,1,Lärostoff
173,1763,1,I betydande omfattning bör undervisningen i hembygdskunskap avse att ge eleverna en första samhällsoch naturorientering
173,1763,2,Den syftar bla till att underlätta övergången för dem från hemmet och den lilla kamratgruppen till de större sociala enheterna skolan och närsamhället
173,1763,3,Den skall lägga grunden för en fortsatt objektiv orienterande undervisning
173,1764,1,"Arbetet med huvudmomenten under rubriken Hem, skola och samhälle bör utgå från skolan, eftersom denna är den nya miljö, som barnen skall anpassa sig till och vara med om att utforma tillsammans med andra"
173,1764,2,"Paralleller kan dras med den kända miljön, hemmet, där de har sina flesta konkreta upplevelser"
173,1764,3,"Det är viktigt, att de känner sig hemma i skolan"
173,1764,4,"Deras känsla av trygghet, trivsel och arbetsglädje under de första skolåren påverkar inställningen till arbetet under den fortsatta skolgången"
173,1765,1,"Orienteringen i skolsamhället fortsätter inom de flesta intresseområden, som ingår i Hem, skola och samhälle"
173,1765,2,Undervisningen utsträcks därefter till områden och sammanhang utanför de närmast liggande miljöerna
173,1765,3,"Dessa ansluter till det geografiskt betonade huvudmomentet I hembygden, och barnen bör genom besök och samtal få en första elementär orientering även om dessa miljöer"
173,1765,4,"Vidare bör reda skapas i fråga om sociala föreställningar, som eleverna tillägnat sig"
173,1765,5,Viktigt är att undervisningen ger dem motivering för goda vanor och för samarbete med andra barn och med vuxna
173,1766,1,Ett angeläget syfte i undervisningen
173,1767,1,"Exkursioner och studiebesök, företrädesvis kortvariga sådana med begränsade studieuppgifter"
173,1768,1,bör vara att ge en nyanserad bild av verkligheten och att motverka traditionella föreställningar om könsroller
173,1768,2,Man bör utgå från att pojkar och flickor kan ha samma intressen och samma beteendemönster
173,1768,3,"Med utgångspunkt i elevernas egna erfarenheter kan olika familjetyper behandlas, tex familjer med ensamstående förälder, familjer där fadern eller modern är hemma, familjer där båda föräldrarna förvärvsarbetar"
173,1768,4,"Redan på detta stadium bör undervisningen «söka klargöra, att män och kvinnor kan utföra samma arbetsuppgifter både i hemmet och på arbetsmarknaden, ge konkreta exempel på avvikelser från det traditionella könrollsmönstret och stimulera eleverna att ifrågasätta den arbetsfördelning efter kön som de möter i omgivningen"
173,1768,5,Se vidare allmänna anvisningar (s 49)
173,1769,1,"I momentet Hem, skola och samhälle ingår också säkerhetssynpunkter på tingen kring barnen"
173,1769,2,"I omgivningen finns ämnen och företeelser, som det har stor praktisk betydelse, att de känner till, kan reda sig med och har respekt för, t ex eld, elektricitet, gas samt giftiga och brandfarliga ämnen"
173,1769,3,Upprepade gånger och i olika sammanhang bör sådant tas upp till behandling
173,1769,4,"Detta stoff har, förutom rent praktisk betydelse för åldersstadiet, också värde för senare studier, bl a i fysik och kemi"
173,1770,1,Momentet Helger och festdagar bör ge en känsla av värdet av högtid och tradition
173,1770,2,Samvaron i klassen och den övriga skolan ger rika tillfällen att låta barnen konkret uppleva detta
173,1771,1,"Samtal om betydelsen av god hälsa och goda vanor leder naturligt in intresset på människokroppen, dess byggnad, funktioner och behov"
173,1771,2,"Denna undervisning bör leda fram till kännedom om enkla hälsoregler, t ex beträffande goda kostvanor, tandvård, kroppsrörelse och sömn"
173,1771,3,"Barnens upplevelser och spontana frågor kan aktualisera, att användningen och verkningarna av alkohol, tobak och andra gifter behandlas redan under de första skolåren"
173,1771,4,En mera samlad framställning bör då förekomma i årskurs 3 och där ske huvudsakligen utifrån iakttagbara sociala verkningar
173,1772,1,"En förberedande sexualundervisning kan ofta få en naturlig utgångspunkt i samtalen om hemmet, om far, mor och syskon"
173,1772,2,Andra lämpliga utgångspunkter är elevernas frågor I anslutning till iakttagelser av hur livet förs vidare hos djur och växter
173,1772,3,Elevernas frågor bör besvaras öppet och sakligt
173,1772,4,Undervisningen I sexual- och samlevnadsfrågor bör i regel ske i samverkan med hemmen
173,1772,5,Se vidare allmänna anvisningar (s 52) och SO:s handledning i sexualundervisning
173,1773,1,"Trafikundervisningen, som upptagits under rubriken I! trafiken, bör främst bedrivas I form av praktiska övningar, som skall vara ägnade att underlätta elevernas eget uppträdande i trafiken"
173,1773,2,Lokala förhållanden måste därför vara avgörande för undervisningens planering
173,1773,3,"En koncentration till vissa perioder under läsåret kan vara ändamålsenlig, t ex till höstterminens början, slutet av höstterminen och början av vårterminen samt vårterminens slut"
173,1773,4,Övningar i gångtrafik kan koncentreras till årskurs 1 och i cykeltrafik till årskurs 2 eller 3
173,1773,5,"Av grundläggande betydelse för undervisningens resultat är, att eleverna får uppleva, att de själva har ansvar för sitt uppträdande I trafiken och att samverkan vid undervisningens uppläggning och genomförande sker med hemmen och den lokala polismyndigheten"
173,1773,6,Se vidare allmänna anvisningar (s 53)
173,1774,1,Den elementära geografiska orienteringen inom hembygdskunskapen bör helst ske med utgångspunkt i vad eleverna lakttar och lär känna i sin egen hemtrakt
173,1774,2,Alla möjligheter till exkursioner bör därför utnyttjas
173,1774,3,ArOrienteringsämnen
173,1774,4,"Hembygdskunskap 179 betet bör bla resultera i att barnen tillägnar sig vissa färdigheter, enkla begrepp och vanliga termer, som kan utgöra en grund för den kommande undervisningen i geografi"
173,1774,5,"Vilka miljöer, som bör tas upp till behandling, beror på den omgivande bygdens struktur"
173,1774,6,Exempel: Gården på slätten
173,1774,7,Skogen ger oss bärgning
173,1774,8,Det rika berget
173,1774,9,Vi bor vid kusten
173,1774,10,"I det hela bör undervisningen röra sig inom en naturlig geografisk enhet, tex mälarbygden, västkusten eller en norrländsk skogsbygd"
173,1774,11,I vissa fall kan ett sådant område i sina huvuddrag sammanfalla med hemlandskapet eller hemlänet
174,1776,1,"Barnens intresse för ”hur det var förr” bör vara utgångspunkten för en begynnande orientering om hur människor levde och verkade i hembygden under äldre tider, t ex på barnens far- eller morföräldrars tid"
174,1776,2,Undervisningen bör här naturligen få formen av valda berättelser och enkla bilder
174,1776,3,"Även de miljöbilder från sten-, bronsoch järnåldern, som ingår i huvudmomenten under rubriken Förr i världen, bör ha denna karaktär med hänsyn till elevernas ringa förmåga att se sammanhang och överblicka längre tidsperioder"
174,1777,1,"Barnens spontana intresse för växter och djur bör tillvaratas: upptäckarglädjen bör uppmuntras, kunskaperna utökas, ansvarskänslan väckas (naturvård, djurskydd) och känslan för skönheten i naturen odlas"
174,1777,2,"Detta kan ske bla vid direkta, helst fortlöpande iakttagelser I skolans omgivningar"
174,1777,3,Kontakten med tama djur av något slag är en verklighet för de flesta barn
174,1777,4,Detta gör att frågor som rör husdjuren och omvårdnaden av djur i vår närhet bör behandlas i lämpliga sammanhang i lågstadiets alla årskurser
174,1778,1,"Vid behandlingen av momentet Tid och väderlek bör endast allmänorienterande kunskaper eftersträvas, och de nämnda väderleksdiagrammen bör utgöra enklaste form av grafisk framställning"
174,1779,1,Praktisk ekonomisk fostran är ett viktigt led i hembygdskunskapen
174,1779,2,"Det dagliga livet i skolan och behandlingen av området Varor och andra ekonomiska värden liksom även områdena Hem, skola och samhälle samt Vår hälsa ger osökt anledning att lära eleverna sparsamhet och aktsamhet med t ex egna och kamraters tillhörigheter, skolmateriel och inventarier"
174,1779,3,De bör även uppmuntras till sparverksamhet
174,1779,4,"Praktiska övningar att växla, väga och mäta bör förekomma i samband med behandlingen av området Varor och andra ekonomiska värden"
174,1780,1,Undervisning om tekniska företeelser i vardagslivet blir numera allt nödvändigare redan på lågstadiet
174,1780,2,"Detta motiveras inte minst av elevernas spontana frågor rörande tekniken omkring dem, hemma, i skolan och under fritiden"
174,1780,3,"Deras iakttagelser rör exempelvis användningen av verktyg, redskap, maskiner, apparater och instrument, och frågorna ställs ofta med ett inledande ”varför” eller ""hur kommer det sig att"""
174,1780,4,"Undervisningen bör här inriktas på att så långt möjligt ge elementära förklaringar beträffande funktionen, stimulera till fortsatta iakttagelser, undersökningar och funderingar samt illustrera det aktuella verkningssättet med hjälp av enkla experiment"
174,1781,1,"Aktuella händelser och förhållanden ute i världen får barnen på ett mycket påtagligt sätt kontakt med genom tidningar, radio och television och vid egna sammanträffanden med människor från andra länder"
174,1781,2,Därigenom kommer nya och delvis okända begrepp och miljöer in i barnens föreställningsvärld
174,1781,3,Samtal om olika internationella frågor kan naturligt anknytas härtill
174,1781,4,(Jämför allmänna anvisningar s 48
174,1781,5,") Undervisningen kan i dessa sammanhang «konkretiseras med hjälp av det rika illustrationsmaterial, som finns att tillgå i böcker, diabilder, ljudbildband och filmer, samt genom, t ex dramatiseringar och arbeten i sandlåda och på väggtavla"
174,1782,1,"I ämnet hembygdskunskap ingår teckning, målning, modellering och annat skapande manuellt arbete"
174,1782,2,Denna del av undervisningen bör få en fri och allsidig uppläggning
174,1782,3,Den avser att aktivera och differentiera barnens verklighetsupplevelser genom fritt bild- och formskapande och att
174,1783,1,180 | Orienteringsämnen
174,1783,2,Hembygdskunskap utveckla deras bildsinne
174,1783,3,Den har även den väsentliga uppgiften att tillgodose deras behov av manuellt arbete och att allsidigt utveckla deras motoriska färdigheter
174,1784,1,"Lärarens uppgift bör i första hand vara att stimulera elevernas fantasi och skaparglädje, att ställa varierande, för åldersstadiet lämpligt material till deras förfogande och att lära dem praktiskt arbetssätt"
174,1784,2,Individuella olikheter i deras uttryckssätt bör på allt sätt uppmuntras
174,1784,3,Jfr huvudmomenten i Teckning (s 151) och Slöjd (s 156)
174,1785,1,Planering och samverkan
174,1786,1,"Huvudmomenten har för åskådlighetens skull förts in under sammanfattningsrubriker: Hem, skola och samhälle"
174,1786,2,Helger och festdagar etc
174,1786,3,"Dessa enheter uppdelas i intresseområden eller arbetsområden, kring vilka undervisningen lämpligen kan samlas"
174,1787,1,Huvudmomenten har ej placerats i för undervisningen tänkt ordningsföljd
174,1787,2,"De bör behandlas, när så befinns lämpligt"
174,1787,3,Det är ofta nödvändigt att arbeta med samma stoff vid skilda tillfällen i olika årskurser inom stadiet
174,1787,4,"Aktuella händelser, barnens upplevelser, läsning, film, radio och television inom och utom skolan kan ge anledning till att på nytt ta upp tidigare behandlat stoff"
174,1787,5,"Allteftersom barnens iakttagelseförmåga och färdighet ökar, blir möjligheten till nya utblickar och variation i tillämpningen större"
174,1788,1,Vissa moment tas upp i endast en årskurs
174,1788,2,"Andra åter bör vara genomgående i alla årskurserna på lågstadiet, även om behandlingen i en årskurs kanske blir mera omfattande, medan den i de andra får relativt litet utrymme i något aktuellt sammanhang"
174,1788,3,Exempel på sådana moment är följande: Barnets medansvar i skola och samhälle
174,1788,4,Våra plikter mot medmänniskor
174,1788,5,Internationell förståelse
174,1788,6,Trafikundervisning
174,1788,7,Allmänna hälsoregler
174,1788,8,Tobak och alkohol
174,1788,9,Sexualundervisning
174,1788,10,Växt- och djurstudier
174,1788,11,"Naturvård och djurskydd,"
175,1789,1,Teknik i vardagslivet samt Ekonomiska frågor
175,1789,2,Dessa moment återkommer även på mellan- och högstadiet
175,1790,1,Lokala förhållanden måste få göra sig starkt gällande vid den enskilde lärarens kursplanering liksom hänsynen till elevernas förutsättningar i vederbörande klass
175,1790,2,"Av detta följer, att en gemensam lärogång för olika klasser och skolor inte bör fastställas"
175,1790,3,Den i läroplanssupplementet föreliggande dispositionen av en studieplan avser endast att exemplifiera en fördelning av lämpligt stoff med hänsyn till årstider och olika årskurser
175,1790,4,"Den visar även, hur orienteringen kan fördjupas och sträcka sig över vidare områden allt efter barnens större mognad"
175,1790,5,"Med utgångspunkt i exemplet kan lärarna själva disponera studierna och medverka till att lokalt betonade studieplaner utarbetas, där särskild hänsyn tas till bla bygdens geografiska läge och samhällets struktur"
175,1790,6,"Det är av stor betydelse för undervisningen, att så sker"
175,1791,1,Ett värdefullt hjälpmedel vid planeringsarbetet utgör en noggrann och lättillgänglig förteckning över lämpliga läromedel som finns i skolan
175,1791,2,"Eftersom det är angeläget, att läraren ingående känner även det studiematerial som skolans omgivningar erbjuder, är det önskvärt, att lämpliga studieobjekt i skolans närhet samt föremål för exkursioner och studiebesök ute i bygden är upptecknade och kommenterade samt att förslag till arbetsuppgifter för eleverna finns att tillgå"
175,1791,3,"Sådana förteckningar, upplysningar och uppgifter kan finnas samlade tex i en lokal studieplan eller i ett register i skolan"
175,1792,1,Samverkan med undervisningen i andra ämnen bör planeras och genomföras i första hand med Svenska (s 128) och med Religionskunskap (s 175)
175,1793,1,"Vidare bör anknytning göras till undervisningen i matematik, bla vid vägning och mätning samt arbete med pris- och inköpslistor inom momentet Varor och andra ekonomiska värden"
175,1793,2,"Många av våra barnvisor har samma motivval som hembygdskunskapens intresseområden, varför de flitigt bör utnyttjas"
175,1793,3,"Detsamma gäller om Iekvisorna, som får inspirera till rytmiska rörelser"
175,1793,4,"Inom ett flertal områden har läraren tillfälle att ge barnen hjälp att upptäcka skönheten i former, färger, klanger och rörelser ute i naturen och i vardagslivet"
175,1793,5,Dessa möjligheter bör väl tillvaratas liksom också varje tillfälle att låta eleverna i mån av förmåga få en inblick i konst och litteratur
175,1794,1,I tredje årskursen förekommer ämnet slöjd
175,1794,2,"Med detta ämne bör samverkan ske i lämpliga undervisningssituationer, tex vid arbete med att bygga upp trafikmiljöer samt historiska och geografiska miljöer (modeller) i sandlådan, vid framställning av föremål för dramatiseringar, utställningar etc"
175,1795,1,Arbetssätt och läromedel
175,1796,1,Undervisningen i hembygdskunskap bör i så stor utsträckning som möjligt grundas på elevernas egna iakttagelser av verkligheten
175,1796,2,"Direktstudier i skolan och i dess närhet, exkursioner och studiebesök (studieutflykter) i syfte att iaktta växt- och djurliv, arbetsliv och terrängförhållanden, för att studera samlingar på hembygdsgårdar och museer, konstnärlig utsmyckning i samhället mm bör därför utgöra ett väsentligt inslag i arbetet"
175,1796,3,"Utställningar i klassrummet av insamlade föremål, bilder, klipp o d bör ofta förekomma"
175,1796,4,"De kan på olika sätt befästa de kunskaper som eleverna tillägnat sig under studieutflykten, och inspirera till ytterligare fördjupning i arbetet"
175,1796,5,Om dessa direktstudier och deras efterbehandling se läroplanssupplementet för låg- och mellanstadiets orienteringsämnen
175,1796,6,"Teckning, målning, modellering och annat skapande manuellt arbete, som ingår i ämnet hembygdskunskap bör få ett betydande utrymme i undervisningen"
175,1796,7,"Det bör ge eleverna möjlighet att fritt skildra upplevelser och erfarenheter och att ur fantasin illustrera berättelser, sagor, sånger och lekar"
175,1796,8,Vid lämpliga tillfällen bör deras arbete naturligt ansluta sig till sakundervisningen för att konkretisera lärostoffet
175,1796,9,Härvid får inte för stora krav ställas på exakt utförande
