page,paragraph_id,sentence_num,sentence_text
97,916,1,"Mätning av längd, massa och volym sker med hjälp av de i hemmet vanligaste enheterna och mätinstrumenten"
97,916,2,Avläsning av klockan övas liksom tidsangivelser i tummar och minuter
97,916,3,Användningen och värdet av de vanligaste sedlarna och mynten tas upp i samband med praktiska situationer
97,917,1,Lågstadiet och mellanstadiet
97,918,1,Tidsenheterna utökas från sekunder till år
97,918,2,Även datumangivelser tas upp
97,918,3,"Enkla enhetsbyten och huvudräkning övas i samband med problemlösning som gäller matlagning, beräkning av restider, priser etc"
98,919,1,104 Kursplaner
98,920,1,Mellanstadiet och högstadiet
98,921,1,De vanligaste prefixen behandlas liksom mätnoggrannhet och mätteknik
98,921,2,"Vardagsnära problemlösningar, t ex i anslutning till geometri, hastighet, tidsdifferenser, handel och valuta, för att befästa de vanligaste enheterna"
98,922,1,Högstadiet Uppskattning av fel vid mätningar och avrundningar
98,922,2,Enheter och enhetsbyten i tekniska och naturvetenskapliga sammanhang
98,923,1,GEOMETRI
98,924,1,Undervisningen i geometri skall hjälpa eleverna att organisera uppfattningen om sin omgivning
98,924,2,"Man bör utgå från hemmet och närmiljön samt knyta an till andra ämnen, speciellt geografi, bild och slöjd"
98,924,3,Undervisningen skall också ge eleverna en förmåga att tolka och tillämpa geometriska formler och modeller
98,925,1,Förmågan att tänka i geometriska modeller är i hög grad kopplad till elevernas utveckling
98,925,2,Möjligheterna att uppfatta och arbeta teoretiskt med begrepp som area och volym är mycket begränsade hos de flesta elever under lågstadiet och mellanstadiet
98,925,3,Detsamma gäller också en formell och formelinriktad geometriundervisning på högstadiet
98,926,1,Geometriundervisningen bör därför speciellt på lågstadiet och mellanstadiet vara konkret och praktiskt inriktad
98,926,2,Vidare bör den aritmetik som används vid geometriska beräkningar vara så anpassad att de geometriska grundtankarna inte skyms av räknemässiga svårigheter
98,927,1,Lågstadiet
98,928,1,"Praktisk geometri och geometriska avbildningar,-knutna till symmetri och mätning i konkreta och vardagliga situationer"
98,928,2,"Begreppen sträcka, punkt, kvadrat, triangel, rektangel och cirkel tas upp"
98,929,1,Lågstadiet och mellanstadiet
98,930,1,Laborativa övningar för att bygga upp den geometriska förståelsen
98,930,2,Omkrets tas upp liksom enkla och praktiska exempel på förstoring och förminskning
98,930,3,Detta sker genom koppling till närmiljön i form av ritningar och kartor och föremål som tillverkas i slöjden
98,931,1,"Mellanstadiet och högstadiet Begreppet area tas upp i laborativa situationer och med utgångspunkt i exempel från närmiljön, såsom golv, mattor, väggar, gräs***** PAGE 99 *****"
98,932,1,"Matematik 105 mattor, fotbollsplaner och dylikt"
98,932,2,Begreppet volym behandlas i första hand kopplat till liter- och decilitermått
98,932,3,"Beräkningar bör i dessa sammanhang endast göras för enkla figurer, såsom rektangel, triangel och rätblock"
98,932,4,"Enkla geometriska konstruktioner utförs, t ex konstruktion av rektanglar och cirklar med givna mått"
98,932,5,"Nu bör även en del viktiga begrepp behandlas i samband med de vanligaste två- och tredimensionella figurerna och kropparna, t ex höjd, bas, diagonal, kant och hörn"
98,933,1,Vinkelbegreppet samt mätning och konstruktion av vinklar mindre än 180? tas upp
98,934,1,Skala i vardaglig användning behandlas
98,934,2,Eleverna bör i första hand utnyttja kartors eller ritningars skalangivelse vid enkla överslag eller beräkningar
98,935,1,Högstadiet
98,936,1,Tillämpningar och praktisk användning av geometri i vardagliga situationer vidareutvecklas
98,936,2,"Stoffet väljs från omgivningen och från vardagliga sysselsättningar, tex att sy, sticka, måla och snickra"
98,936,3,Skalbegreppet används främst i praktiska sammanhang
98,937,1,Vidare bör en grund läggas för en mera formaliserad geometri
98,937,2,Denna undervisning kräver stor urskiljning och hänsynstagande till elevens mognad
98,937,3,Begrepp och samband för vinklar i trianglar och fyrhörningar och vid räta linjers skärning samt problem i anslutning därtill tas upp liksom andra vanliga geometriska begrepp och beteckningar
98,937,4,Mätningar och beräkningar av cirkelns omkrets och area samt av polygonområden görs
98,937,5,Kongruens och likformighet behandlas
98,937,6,"Rymdgeometriska figurers konstruktion samt beräkning av begränsningsarea och volym för prisma, cylinder, pyramid, kon och klot tas också upp"
98,938,1,"Några enkla geometriska satser, t ex Pytagoras sats och topptriangelsatsen, bör även ingå"
98,939,1,ALGEBRA OCH FUNKTIONSLÄRA
98,940,1,"Momentet är av mindre vikt i vardagslivet, men alla elever skall ha en viss orientering om stoffet"
98,940,2,"En omsorgsfull individualisering, byggd på elevernas val och förmåga, är nödvändig"
98,941,1,Lågstadiet och mellanstadiet Enkla likheter löses genom prövning
98,942,1,Mellanstadiet och högstadiet Lösning av enkla ekvationer främst genom att pröva och utgå från
100,943,1,106 Kursplaner problem
100,943,2,Funktionsbegreppet introduceras genom praktiska experiment
100,943,3,"Tolkning av enkla funktioner, avbildade i första kvadranten av ett koordinatsystem"
100,943,4,"Beräkning av funktionsvärden genom att sätta in dem i formler, knutna till vardagslivet eller till andra skolämnen"
100,944,1,Högstadiet
100,945,1,Tolkning och konstruktion av grafer i hela koordinatsystemet
100,945,2,"Teckning, förenkling och beräkning av uttryck"
100,945,3,"Parentesuttryck, utbrytning av faktorer samt kvadreringsreglerna och konjugatregeln behandlas, dock med speciellt hänsynstagande till elevernas mognad, intresse och behov"
100,945,4,"Ekvationer av första graden, även med obekanta i båda led samt med parenteser och bråktal"
100,945,5,Problemlösning med enkla ekvationer
100,945,6,"Linjära funktioner, speciellt sådana som anger proportionalitet"
100,946,1,"Linjära ekvationssystem och enkla andragradsekvationer, främst vid problemlösning och företrädesvis med grafisk lösning"
100,947,1,BESKRIVANDE STATISTIK OCH SANNOLIKHETSLÄRA
100,948,1,"En stor del av den information vi får om samhället omkring oss uttrycks i form av tabeller, diagram och sannolikheter"
100,948,2,Undervisningen syftar i första hand till att lära eleverna tolka och värdera denna information
100,948,3,"Den bör integreras med undervisningen i orienteringsämnena och bygga på reella data från närmiljö, samhälle och världen i stort"
100,948,4,"Arbetet inom detta moment är speciellt lämpligt att utföras i grupp, gärna som temaarbeten"
100,949,1,Lågstadiet Insamling av data samt tolkning av enkla tabeller och diagram
100,949,2,Konstruktion av diagram görs lämpligen laborativt
100,950,1,Lågstadiet och mellanstadiet
100,951,1,Systematiseringen av insamlade data byggs ut och framställning och tolkning av stapeldiagram och linjediagram behandlas liksom medelvärdesbegreppet
100,952,1,Mellanstadiet och högstadiet
100,953,1,Beräkning av medelvärde
100,953,2,Framställning och tolkning av bl a cirkeldiagram och stolpdiagram
100,953,3,Frekvens och frekvenstabeller i samband med egna undersökningar
100,953,4,"Kritisk granskning av olika sätt att presentera statistiskt material, t ex i reklam"
100,953,5,Undersökning av sannolikhet för händelser
101,954,1,Matematik 107
101,955,1,Högstadiet
101,956,1,"Klassindelning, histogram och enkla lägesmått tas upp liksom relativa frekvenser och relativa frekvensers stabilitet"
101,956,2,Sannolikhetsbegreppet och beräkning av sannolikheter i enkla fall
101,957,1,Exempel på olika yrken där kunskap om statistik och sannolikhetslära är betydelsefull
101,958,1,DATALÄRA
101,959,1,Alla elever bör orienteras om användningen av datorer i samhället och om den snabba utvecklingen på området
101,959,2,Speciellt gäller det att eleverna inser att datorn är ett tekniskt hjälpmedel som styrs av människor
101,960,1,Högstadiet
101,961,1,Datorfunktionerna med tyngdpunkt i datorprogrammets uppgift och metoder för problemlösning
101,961,2,"Några olika databehandlingsområden, där betydelsen av den snabba tekniska utvecklingen särskilt uppmärksammas"
101,962,1,Exempel på olika yrken där kunskap om datorer är betydelsefull
102,963,1,MUSIK
102,964,1,Musik ingår i grundskolans undervisning därför att
102,965,1,"O elevernas musikintresse och musikaliska förmåga skall utvecklas,"
102,966,1,"O eleverna skall lära känna musikens olika uttrycksmedel och olika musikarter,"
102,967,1,0 eleverna skall få kunskap om olika kulturers och epokers musikstilar
102,968,1,MÅL Undervisningen skall ta till vara elevernas förutsättningar och möta deras behov
102,968,2,Undervisningen syftar till att få eleverna att använda flera av musikens olika uttrycksmedel samt vårda röst och tal
102,968,3,Undervisningen skall låta eleverna uppleva glädje och gemenskap
102,968,4,Den skall ha en sådan utformning att den ger alla möjlighet att medverka aktivt
102,968,5,Den skall därigenom bidra till elevernas personliga och sociala utveckling
102,969,1,"Eleverna skall få kunskap om musiken och dess funktion och villkor i olika miljöer, kulturer och tider"
102,969,2,De skall härigenom lära känna bl a invandrarländernas olika kulturtraditioner
102,970,1,"När det gäller dagens musik och olika musikmiljöer, skall eleverna tränas att kritiskt granska och diskutera musikens roll samt de krafter som styr musikutbudet"
102,970,2,"Härigenom skall de göras medvetna om den påverkan de utsätts för, då det gäller livsstil, konsumtionsvanor, attityder och värderingar"
102,971,1,Skolans musikliv är en källa till gemenskap
102,971,2,"Det skall möjliggöra samarbete över årskurs-, stadie- och ämnesgränser samt främja kontakten med det övriga musiklivet i samhället"
102,971,3,Eleverna skall härigenom stimuleras till kontakt med musik även efter avslutad skolgång
103,972,1,HUVUDMOMENT
103,973,1,Musik 109
103,974,1,ATT MUSICERA TILLSAMMANS
103,975,1,Lågstadiet Eleverna skall
103,976,1,OO
103,977,1,OO
103,978,1,OO
103,979,1,"utföra enkla rytm- och rörelseövningar med eller utan musik för att uppleva och träna bl a puls, takt, rytm, tempo och dynamik,"
103,980,1,"leka med rytm i ord och meningar, talkörer och ramsor,"
103,981,1,"spela rytmorkester till musik, dels fritt och dels bundet till enklare notvärden,"
103,982,1,"träna det melodiska och rytmiska gehöret,"
103,983,1,"dansa sånglekar och lära sig enkla danssteg till olika sorters musik,"
103,984,1,"sjunga visor och sånger som anknyter till deras intressen, till olika temaområden i skolarbetet och till vuxenvärlden,"
103,985,1,"spela på enkla musikinstrument i anslutning till sång eller andra aktiviteter,"
103,986,1,"dramatisera sånger, berättelser m m med ljud och rörelse"
103,987,1,Mellanstadiet Eleverna skall
103,988,1,OO
103,989,1,"utföra rytm- och rörelseövningar för att uppleva regelbundenhet och balans i puls, takt och rytm samt öva dynamik och tempoförändringar,"
103,990,1,"utföra olika sorters rytm- och rörelselekar för att tillgodose rörelsebehov och utveckla rytmkänsla,"
103,991,1,"dansa danser, bl a sådana som de själva föreslår och instruerar,"
103,992,1,"sjunga sånger och visor såväl svenska och nordiska som sånger och visor från andra länder och världsdelar,"
103,993,1,"sjunga sånger och visor som anknyter till deras vardag och till olika temaområden,"
103,994,1,"studera sånger och instrumentalstycken med inriktning på karaktär, spänning — avspänning, klang, utförande m m,"
103,995,1,"spela på melodi-, ackord- och rytminstrument företrädesvis i anslutning till sång, dikt, dans och rörelse, gehörsmässigt eller efter enklare noter,"
103,996,1,"läsa ramsor och ordlekar, traditionella och moderna i bearbetad form eller improviserat för att uppleva textrytm, ordvalör m m"
104,997,1,110 Kursplaner
104,998,1,Högstadiet Eleverna skall
104,999,1,"Od genom rörelse och spel arbeta med rytmer från olika världsdelar och kulturer, även jazz och poprytmer,"
104,1000,1,"Q spela på olika melodi-, ackord- och rytminstrument till sång, dikt, dans eller rörelse, inlärt på gehör eller efter noter,"
104,1001,1,"O sjunga sånger från skilda tider och genrer med skiftande innehåll och karaktär, även dagsaktuella sånger,"
104,1002,1,"0 utföra ljudkompositioner med instrument, röster och andra ljudkällor"
104,1003,1,ATT SKAPA MUSIK
104,1004,1,Elevernas eget skapande skall vara en motvikt mot passiviserande och stereotyp musik
104,1004,2,"Eleverna skall få möjlighet att på ett enkelt sätt uttrycka sig i ord, ton, klang, ljud, rytm och rörelse, individuellt eller i grupp"
104,1005,1,Lågstadiet
104,1006,1,Eleverna skall få möjlighet att
104,1007,1,"OD fantisera i fria rörelser, improvisera egna danssteg och danser till musik eller egna ljudillustrationer,"
104,1008,1,"0 tillsammans göra melodier och skriva texter för att träna musikalisk fantasi och språklig uttrycksförmåga,"
104,1009,1,"OO skapa effekter och stämningar med hjälp av ljud till dikt och prosa samt lära sig nedteckna dessa med enkla visuella symboler,"
104,1010,1,0 tillverka enkla musikinstrument samt pröva användningsområden för dessa
104,1011,1,Mellanstadiet Eleverna skall få möjlighet att
104,1012,1,"O improvisera eller arrangera melodier, klanger och rytmer på olika instrument bl a som ackompanjemang till spel, sång, dikt, dans och rörelse,"
104,1013,1,"0 skapa egna danser,"
104,1014,1,"Od komponera egna melodier och skriva egna texter för att förverkliga idéer och uttrycka känslor och åsikter,"
104,1015,1,"0 experimentera med olika ljudkällor och göra inspelningar av dessa, imitera vanliga ljud i samhälle och natur eller hitta på egna ljud, göra ljudberättelser eller fria ljudkompositioner,"
105,1016,1,Musik 111
105,1017,1,"OC arrangera egna eller andras texter såsom dikter, ramsor m m till röst- och ljudkompositioner,"
105,1018,1,"0 tillverka enkla musikinstrument, gärna i samverkan med slöjd, och pröva användningsområden för dessa"
105,1019,1,Högstadiet
105,1020,1,Eleverna skall få möjlighet att
105,1021,1,"OD improvisera i rörelse och rytm, inspirerade av musik, dikter, berättelser, händelser m m,"
105,1022,1,"0 göra ljudkompositioner med instrument, röster och andra ljudkällor,"
105,1023,1,"0 improvisera ackompanjemang på olika melodi-, ackord-, och rytminstrument till sång, dikt, dans eller rörelse,"
105,1024,1,"O dramatisera på teman från olika länder och tider, aktuella händelser m m,"
105,1025,1,"0 komponera egna melodier och skriva egna texter för att förmedla känslor, tankar och åsikter i kamratkretsen, skolan och närsamhället"
105,1026,1,MUSIKEN I SAMHÄLLET OCH VÄRLDEN
105,1027,1,Musiken skall inte studeras isolerad utan skall ses mot bakgrund av den kultur i vilken den utvecklats
105,1027,2,Kännedom om de människor som utövar eller utövat musiken och om deras livsvillkor bidrar till förståelse och inlevelse
105,1028,1,Lågstadiet Eleverna skall få möjlighet att
105,1029,1,"O lyssna till kortare musikstycken av olika karaktär och från olika epoker och genrer och illustrera dem i ord och bild,"
105,1030,1,"O upptäcka och diskutera ljuden i skolan, närmiljön, naturen och samhället och bli medvetna om hur musik och ljud påverkar oss i olika sammanhang,"
105,1031,1,0 lära känna några vanliga musikinstrument
105,1032,1,Mellanstadiet Eleverna skall få möjlighet att
105,1033,1,"O studera sångtexter med avseende på tids- och miljöskildringar, samhällsvärderingar, budskap m m, studera samband mellan"
106,1034,1,"112 Kursplaner musik och text samt upptäcka hur sociala och ekonomiska faktorer påverkar musiken,"
106,1035,1,"OD studera ljud och musik inom film och teater,"
106,1036,1,"0 studera principer för tonalstring, resonans m m hos orkesterinstrument och folkliga instrument samt instrument från främmande kulturer,"
106,1037,1,0 studera och diskutera ljudet som miljöfaktor i skolan samt musiken och ljuden i närmiljön och samhället samt diskutera åtgärder för förbättringar
106,1038,1,Högstadiet Eleverna skall få möjlighet att
106,1039,1,"O studera musik från olika världsdelar, kulturer och genrer bl a med inriktning på musikens sociala, ekonomiska och religiösa funktioner och uppmärksamma den passiviserande och stereotypa musik som förekommer i många ungdomsmiljöer,"
106,1040,1,"0 vidga sin instrumentalkännedom genom att studera instrumentens konstruktion och funktion och genom att i samarbete med de naturorienterande ämnena få kännedom om de elektroniska instrumenten och den teknik som är tillämpbar på dessa,"
106,1041,1,0 lära sig det väsentligaste om vård och användning av fonogram och ljudteknisk apparatur samt om konsumentfrågor i samband med inköp
106,1042,1,Exempel på olika yrken där kännedom om musik är betydelsefull
107,1043,1,ORIENTERINGSÄMNEN
107,1044,1,Orienteringsämnena består av naturorienterande och samhällsorienterande ämnen
107,1045,1,"De naturorienterande är biologi, fysik, kemi och teknik"
107,1045,2,"De samhällsorienterande är geografi, historia, religionskunskap och samhällskunskap"
107,1045,3,På lågstadiet ingår ämnet bild samt moment ur ämnena hemkunskap och slöjd
107,1046,1,Även på mellan- och högstadierna har de tre sistnämnda ämnena beröringspunkter med orienteringsämnena
107,1046,2,Deras kursplaner bör därför uppmärksammas när undervisningen i orienteringsämnena planeras
107,1047,1,Studiet av orienteringsämnena får inte bli ensidigt teoretiskt
107,1047,2,"I dem alla bör finnas inslag av exkursioner, studiebesök och/eller fältarbete, i förekommande fall även av experiment, laborationer och praktiskt arbete"
107,1047,3,Arbetsmetoderna bör variera och komplettera varandra
107,1048,1,De naturorienterande och de samhällsorienterande ämnena skall stödja och komplettera varandra
107,1048,2,Därför har huvudmomenten inom de båda sektorerna grupperats efter samma modell:
107,1049,1,Naturorienterande ämnen Samhällsorienterande ämnen
107,1050,1,Människan Människan Människan och naturen Människans omgivning Människans verksamhet Människans verksamhet — i tidsperspektiv — i samhällsperspektiv Människans frågor inför livet och tillvaron
107,1050,2,Religionskunskap”
107,1051,1,""" När en elev enligt skollagen $ 27 befriats från undervisningen i religionskunskap skall i samråd mellan hemmet och skolan överenskommas hur detta praktiskt skall ordnas"
107,1051,2,Med hänsyn till de speciella motiv som i varje enskilt fall föreligger och undervisningens uppläggning i ifrågavarande klass får från fall till fall avgöras vilka lektioner och avsnitt som eleven skall vara befriad ifrån
108,1052,1,114 Kursplaner
108,1053,1,Orienteringsämnen ingår i grundskolans undervisning därför att
108,1054,1,"O eleverna skall lära sig förstå människolivets betingelser och samspelet med omgivningen, tekniken och naturen,"
108,1055,1,"OD eleverna skall få kunskap om naturen och dess lagar,"
108,1056,1,"OD eleverna skall få kunskap om mänsklig verksamhet förr och nu,"
108,1057,1,"O eleverna skall få kunskap om medborgarnas rättigheter och skyldigheter,"
108,1058,1,O eleverna skall få kunskaper om och kontakt med livsåskådningsfrågor
108,1059,1,NATURORIENTERANDE
108,1060,1,ÄMNEN
108,1061,1,"MÅL Genom undervisningen i de naturorienterande ämnena skall eleverna vidga och fördjupa kunskaperna om sig själva, naturen och människans verksamhet"
108,1062,1,Undervisningen skall leda till att eleverna lär sig hur människokroppen fungerar
108,1062,2,Den skall ge en överblick över olika hälsoproblem bl a rörande arbetsmiljö och beroendeframkallande medel
108,1062,3,Eleverna skall på så sätt få kunskap om olika hälsorisker samt om hur man bygger upp och bevarar sin hälsa
108,1062,4,"De skall uppmuntras att aktivt arbeta för hälsofrämjande vanor, t ex i fråga om alkohol, narkotika och tobak, både när det gäller dem själva och andra"
108,1063,1,Eleverna skall lära känna vanliga växter och djur och få perspektiv på hur olika former av liv har utvecklats på jorden
108,1063,2,"Vidare skall eleverna få kunskap om hur naturen fungerar, vanliga naturtypers"
109,1064,1,Orienteringsämnen
109,1064,2,Naturorienterande ämnen 115 uppbyggnad samt hur människan tidigare och i dag påverkar naturmiljön
109,1064,3,"Undervisningen skall visa hur kunskap om naturmiljön kan användas i samhällsarbetet, göra eleverna medvetna om människans ansvar för sin och kommande generationers livsmiljö och väcka deras respekt för allt levande"
109,1065,1,Undervisningen skall ge eleverna en orientering om ämnens uppbyggnad och reaktioner
109,1065,2,De skall få inblick i hur denna kunskap används för att förbättra våra levnadsvillkor men också vilka risker ' användningen kan medföra
109,1066,1,Undervisningen skall ge en orientering om fysikaliska företeelser av betydelse för kunskapen om vår värld
109,1066,2,Den skall belysa hur upptäckter inom naturvetenskapen förändrat människans uppfattning om världen och hur vår världsbild ständigt ändras i takt med nya upptäckter
109,1066,3,:
109,1067,1,"Eleverna skall få kunskaper om den tekniska utvecklingen och om hur tekniken kan förändra vår tillvaro, påverka arbetsförhållanden och sysselsättning och inverka på vår miljö"
109,1067,2,"Därigenom skall de få bättre förutsättningar att förstå, kritiskt granska och aktivt ta ställning till olika problem i det tekniskt komplicerade samhälle vi lever i"
109,1068,1,"Undervisningen skall leda till att eleverna får en orientering om olika arbetsmiljöer, industrier och tillverkningsprocesser"
109,1068,2,"De skall därigenom få insikt i olika yrken och i människors arbetsförhållanden, så att de lättare kan ta ställning till sin egen framtid och arbeta för en förbättrad miljö"
109,1069,1,Eleverna skall ges möjlighet att träna sådana vardagsfärdigheter som är viktiga för dem som konsumenter både då det gäller varor och hushållning med naturresurser
109,1069,2,"De skall i praktiskt arbete och i samverkan med hemkunskap lära sig klara göromål i hemmet och skolan, klara av enklare reparationer och förbättringar"
109,1069,3,De skall känna till hur vanliga tekniska hjälpmedel är konstruerade och praktiskt lära sig hur man använder dem
109,1070,1,Undervisningen skall göra eleverna medvetna om de risker som finns i människans verksamhet och omgivning samt om det ansvar och de möjligheter man har att handskas med dem
109,1071,1,I alla de naturorienterande ämnena skall eleverna lära sig att använda ett experimentellt och undersökande arbetssätt
109,1071,2,"Laborationer, fältstudier och praktiskt arbete skall prägla undervisningen"
109,1071,3,Eleverna skall lära sig att tolka beskrivningar och bruksanvisningar och redovisa iakttagelser och experiment både muntligt och skriftligt
109,1071,4,"De skall utveckla sin förmåga att upptäcka och identifiera problem, ge förslag till tänkbara lösningar, pröva dessa och själva söka bedöma resultatet"
110,1072,1,116 Kursplaner
110,1073,1,HUVUDMOMENT
110,1074,1,MÄNNISKAN
110,1075,1,Lågstadiet Kroppen och dess funktioner som de kan studeras utifrån barnens egna iakttagelser
110,1076,1,"Fortplantning, födelse, åldrande och död"
110,1076,2,Känslor och konflikter diskuteras och bearbetas i aktuella situationer
110,1077,1,"Vila, kost, hygien och rörelse i sammanhang som är kända för barnen"
110,1078,1,"Läkemedel, alkohol, narkotika och tobak"
110,1079,1,Mellanstadiet Grundläggande frågor som rör människokroppens funktioner och byggnad
110,1080,1,"Fortplantning, födelse, åldrande och död"
110,1080,2,"Om människors utveckling, företrädesvis under barn- och ungdomsåren"
110,1080,3,Sexual- och samlevnadsfrågor belyses mot bakgrund av olika uppfattningar i klassen
110,1080,4,Något om ärftligheten hos människan
110,1081,1,Hälsa och sjukdom
110,1081,2,Åtgärder som barnen själva kan vidta för att förebygga och behandla sjukdomar och olycksfall
110,1082,1,Exempel på miljöns betydelse för människans utveckling
110,1083,1,"Alkohol, narkotika, tobak och andra skadliga ämnen"
110,1083,2,Förekomst och negativa verkningar för individen och samhället
110,1084,1,Högstadiet
110,1085,1,Nervsystemet och sinnesorganen
110,1085,2,Andningen och cirkulationen i kroppen
110,1085,3,Rörelseapparaten
110,1085,4,Träning och kondition
110,1085,5,Olika handikapp
110,1086,1,Matsmältningsorganen
110,1086,2,Födans kemiska sammansättning och dess näringsvärde
110,1086,3,Vårt behov av lämpligt sammansatt föda
110,1086,4,Följder av en felaktigt sammansatt föda
110,1087,1,"Fortplantning, födelse, åldrande och död"
110,1087,2,Samlevnads- och sexualfrågor
110,1088,1,Arv — miljö
110,1088,2,Utveckling av beteenden och social organisation
110,1088,3,Könsroller
110,1089,1,"Friskvård, hygien och smittorisker"
110,1089,2,Allergier
110,1089,3,Vanliga sjukdomar och sjukvård
110,1089,4,"Olyckor, första hjälpen vid olycksfall"
110,1089,5,"Övningar i att bära, lyfta och sitta rätt"
110,1089,6,Olika arbetsmiljöers inverkan på människan
110,1090,1,"Läkemedel, lösningsmedel, alkohol, narkotika och tobak"
110,1090,2,Deras giftverkan och hur man kan undvika dessa gifter
110,1090,3,Möjligheter att komma ur ett beroende
110,1090,4,Olika orsaker till missbruk
110,1090,5,Vuxnas och kamraters roll och ansvar som normbildare
111,1091,1,Orienteringsämnen
111,1091,2,Naturorienterande ämnen 117
111,1092,1,NATUREN OCH MÄNNISKAN
