page,paragraph_id,sentence_num,sentence_text
128,1074,7,"På högstadiet gäller dock att inlärning av och övningar med nya fackord i princip skall ske inom det ämne, där orden införts och hör hemma"
128,1075,1,"Konkreta illustrationer (föremål, bild, ljud, dramatisering) kan på alla stadier  utnytjas som stöd för ordstudium"
128,1075,2,"Likaså kan väl valda texter och illustrationer ge eleverna underlag för träning att observera, söka upp eller själva komma på synonyma ord och uttryck, motsatsord, träffande ord och fraser och bildliga uttryck"
128,1075,3,Sådana övningar bör så långt som möjligt förekomma i ett för eleverna aktuellt stoffsammanhang
128,1075,4,"Det är också lämpligt att samla ord till aktuella arbetsområden och studera ordens betydelse, släktskap, böjning och stavning"
128,1076,1,"Undervisningen i rättstavning syftar till att successivt lära eleverna att rätt stava i tal och skrift allmänt förekommande ord med särskilt beaktande av deras eget vid skrivning använda ordförråd, öva dem att uppmärksamma felstavade ord och vänja dem att begagna ordlista som en hjälp vid stavningen"
128,1076,2,Övning i detta syfte bör i lämpliga sammanhang ansluta till såväl muntlig som skriftlig framställning och till läsning och ingå som ett naturligt led i allmän ordkunskap och språklära
128,1077,1,Ovningsformerna bör vara mångsidiga och arbetet bedrivas med beaktande av att förmågan att stava rätt är individuell
128,1077,2,"De som har utpräglade stavningssvårigheter måste på ett tidigt stadium få individuell hjälp, om möjligt av specialist"
128,1078,1,Eleverna måste också ges en allmänbildande orientering om hur de språkliga uttrycksmedlen är konstruerade och hur de fungerar
128,1078,2,"Sålunda bör de efter hand få en uppfattning om språkets centrala betydelse som meddelelseform, om olika typer av symboler, grundläggande skillnader mellan talat språk och skrivet, mellan vårdat och ovårdat språk samt om enkla språkliga strukturer"
128,1078,3,"Eleverna bör därvid övas att själva dra slutsatser om språkets byggnad och funktion genom iakttagelser av de olika företeelser, som möter dem i det språk de talar, skriver, läser och hör"
128,1078,4,"Till en början behandlas ett ytterst begränsat stoff, som försiktigt vidgas med hänsyn till elevernas aktuella behov, deras anlag och förutsättningar"
128,1078,5,I de lägre årskurserna erbjuder sig många tillfällen att i samband med elevernas muntliga och skriftliga framställning påvisa hur ord böjs och varieras och hur satser kan byggas för att göra språket smidigare och rikare
128,1079,1,Läraren måste alltid ta hänsyn till att många elever har svårt att förstå abstrakta grammatiska sammanhang
128,1079,2,Grammatiska termer skall införas med stor försiktighet och endast då de blir till redskap som främjar elevernas förmåga att allt bättre behandla de språkliga uttrycksmedlen
128,1079,3,ÖOvningarna bör vara varierade (analyserings- och struktureringsövningar) och gälla språket i funktion; de bör inte vara för omfattande och skall inriktas på den praktiska nyttan
128,1079,4,Elever som är mogna för och intresserade av språkanalys bör få lämpliga individuella uppgifter
128,1080,1,"Ovning att sätta ut skiljetecken förekommer skoltiden igenom, till en början under lärarens ledning"
128,1081,1,Språkets liv och förändringar studeras i lämpliga sammanhang
128,1081,2,"Eleverna bör göras medvetna om riksSvenska 135 språket och dess regionala skiftningar, om dialekter och gruppspråk av olika slag, om växelspelet mellan språkarterna och om språket som social faktor"
130,1083,1,Språken i de nordiska länderna
130,1084,1,Undervisningen i och orienteringen om grannländernas språk syftar till att underlätta den språkliga förståelsen mellan de nordiska folken
130,1084,2,Bl a har våra dagars kommunikationer och massmedierna gjort detta till en alltmer angelägen uppgift och samtidigt gett skolan ökade förutsättningar att lösa den
130,1085,1,När det gäller undervisningen i danska och norska är det inte fråga om att eleverna skall lära sig tala dessa språk
130,1085,2,De bör däremot lära sig förstå i synnerhet vad de hör men också vad de läser tyst
130,1085,3,Det bör aldrig vara fråga om språkundervisning I vanlig mening utan om en successiv tillvänjning
130,1085,4,"Denna bör ske så, att eleverna får kontinuerlig träning främst i att lyssna men också att efter hand I ökad utsträckning läsa tyst"
130,1085,5,Vid jämförelser språken emellan bör likheterna I första hand studeras
130,1085,6,Tyngdpunkten bör konsekvent läggas på förmågan att förstå danska och norska och att utnyttja språket som ett medel till kontakt
130,1085,7,"Tillvänjningen på lågstadiet bör sättas in så, att eleverna upplever mötet med dessa grannspråk som naturligt och lustbetonat"
130,1085,8,"Det finns all anledning att från den synpunkten vara restriktiv både när det gäller uttalsövningar, översättning och grammatik"
130,1085,9,"Det är motiverat att ägna uppmärksamhet åt de ljud och ljudförbindelser som erfarenhetsmässigt särskilt försvårar uppfattningen av språken I fråga, men att träna uppläsning av längre textpartier är dåligt använd tid"
130,1085,10,"Att ge den direkta motsvarigheten till centrala ord eller meningar kan i vissa fall vara den snabbaste och mest naturliga vägen till förståelse, men att mer regelbundet översätta vad man läser kan göra läsningen olustbetonad"
130,1085,11,Det är visserligen viktigt att eleverna efter
130,1086,1,"136 | Svenska hand lär sig ett nödvändigt minimum av centrala ord, men lika viktigt är att de lär sig konsten att förstå det väsentliga i en text utan att fastna på varje obekant ord"
130,1086,2,"Någon orientering om vissa former och uttryckssätt, tex om systemet bakom de danska räkneorden och om åtskilliga för en svensk främmande pronomen, ges efter hand, men detta studium får inte bli ett självändamål utan bör begränsas till vad som krävs för den praktiska språkförståelsen"
130,1087,1,"I samband med studiet av danska och norska skall eleverna orienteras om språksituationen i Norden över huvud, alltså bl a om språkutvecklingen i Norge, om finskan och svenskan i Finland samt om den roll icke nordiska språk spelar i vårt land"
130,1087,2,I bygder med även finsktalande befolkning och med tillgång till finsktalande lärare bör finskan ägnas speciell uppmärksamhet
130,1087,3,"Prov på finsk, färöisk och isländsk barnlitteratur kan visas i episkop, och med bandspelarens hjälp kan eleverna få höra, hur dessa språk låter"
131,1088,1,Matematik
131,1089,1,MÅL
131,1090,1,Undervisningen i matematik skall utgå från elevernas erfarenheter och föreställningar och grundas på förståelse
131,1090,2,"Den skall efter hand ge förtrogenhet med några väsentliga begrepp och tillvägagångssätt inom m aritmetik, geometri, algebra och beskri""vände statistik s statistik samt kännedom om funktions- och ”sannolikhetsbegreppen"
131,1090,3,"| Undervisningen skall vidare uppöva färdighet i numerisk räkning, även med tekniska hjälpmedel, och ge inblick i hur matematik används i olika sammanhang"
131,1091,1,HUVUDMOMENT
131,1092,1,Lågstadiet
131,1093,1,Antalsbegreppet
131,1093,2,Naturliga tal
131,1093,3,Tallinjen
131,1093,4,Begreppen större än och mindre än
131,1093,5,Positionssystemet
131,1094,1,"Addition, subtraktion, multiplikation och division"
131,1095,1,Huvudräkning
131,1095,2,Overslagsräkning
131,1096,1,"Algoritmer för addition, subtraktion och multiplikation"
131,1097,1,Mätning
131,1097,2,Enheter i anslutning till elevernas erfarenheter
131,1098,1,"Förberedande behandling av moment i det fortsatta matematikstudiet, bla inom geometri"
131,1098,2,"""Problem i anslutning till elevernas erfarenheter och undervisningen i andra ämnen"
131,1099,1,Mellanstadiet
131,1100,1,"Hela tal, decimaltal och rationella tal"
131,1100,2,Tallinjen
131,1100,3,Begreppen större än och mindre än
131,1100,4,Positionssystemet
131,1101,1,"Addition, subtraktion, multiplikation och division av icke-negativa decimaltal med tillhörande algoritANVISNINGAR OCH"
131,1102,1,Allmänna synpunkter mer och i mindre omfattning räkning med tal i bråkform
131,1102,2,"Räkning med negativa tal, huvudsakligen begränsad till addition och subtraktion av heltal"
131,1103,1,Huvudräkning
131,1103,2,Närmevärde
131,1103,3,Avrundning
131,1103,4,Överslagsräkning
131,1104,1,Enkla geometriska begrepp och samband
131,1105,1,Mätning
131,1105,2,Enheter och enhetsbyten
131,1106,1,Procenträkning
131,1107,1,Insamling av statistiska material
131,1107,2,Tabeller och diagram
131,1107,3,Medelvärde
131,1108,1,"Förberedande behandling av moment i det fortsatta matematikstudiet, bla koordinatsystemet"
131,1109,1,Problem i anslutning till elevernas erfarenheter och undervisningen i andra ämnen
131,1110,1,Högstadiet
131,1111,1,"Hela tal, decimaltal, rationella tal och reella tal"
131,1111,2,Tallinjen
131,1111,3,Begreppen större än och mindre än
131,1111,4,Positionssystemet
131,1112,1,"Räkning med icke-negativa decimaltal och, i mindre omfattning, med tal i bråkform, negativa tal och kvadratrötter"
131,1113,1,Huvudräkning
131,1113,2,Närmevärden och räkning med närmevärden
131,1113,3,Avrundning
131,1113,4,Overslagsräkning
131,1113,5,"Användning av räknesticka, räknemaskin och tabell"
131,1113,6,Orientering om datamaskiner
131,1114,1,Räkning med bokstavsuttryck
131,1114,2,"Ekvationer och olikheter, företrädesvis linjära med högst två variabler"
131,1115,1,Koordinatsystemet
131,1115,2,"Funktioner, företrädesvis linjära"
131,1115,3,Grafisk framställning av funktioner
131,1116,1,"Geometri, bla kongruens- och likformighetsavbildningar, vektorer"
131,1116,2,Mätning
131,1116,3,Enheter och enhetsbyten
131,1116,4,"Längd-, area- och volymberäkningar"
131,1116,5,Samband mellan sidor och vinklar i rätvinkliga trianglar
131,1117,1,Procenträkning
131,1118,1,"Beskrivande statistik, bla frekvenstabell, grafisk framställning, medelvärde, median samt något spridningsmått"
131,1118,2,Sannolikheter
131,1119,1,Begreppet matematisk modell
131,1119,2,Problem i anslutning till elevernas erfarenheter och undervisningen i andra ämnen
131,1120,1,föremål
131,1120,2,Förmågan till abstraktion utvecklas successivt och betingas av
131,1121,1,KOMMENTARER
131,1122,1,För barn i förskolåldern uppstår kvantitetsproblem ur enkla vardagsupplevelser
131,1122,2,"I den mån de förmår lösa sådana problem, sker det i regel genom manuella operationer med verkliga elevens mognad och erfarenhet"
131,1122,3,"Eftersom eleverna redan vid skolgångens början företer stora individuella olikheter i fråga om utveckling, måste den inledande undervisningen"
131,1123,1,Matematik 137 ägnas avsevärd uppmärksamhet
131,1123,2,"Den bör äga rum i avspända och stimulerande arbetssituationer, varunder eleverna bereds kontinuerlig övning och läraren efter hand tillägnar sig kännedom om elevernas individuella förutsättningar och behov"
131,1123,3,"Eleverna bör därvid allsidigt få öva visuella, akustiska och motoriska funktioner"
131,1123,4,"Ovningarna, som inte bör vara strängt ämnesbundna, kan bestå i att eleverna får arbeta med olika föremål, läsa bilder i rader eller uppfatta likheter och olikheter i avsikt att lägga grunden för en senare inlärning av symbolerna för språkljud (bokstäver) och för tal (siffror)"
132,1125,1,För ett fåtal elever sker utvecklingen från användning av konkret arbetsmaterial och vardagligt språk över de matematiska begreppen till användning av symboler och matematisk terminologi tämligen snabbt
132,1125,2,För flertalet elever tar processen lång tid
132,1125,3,"Om eleverna alltför tidigt får lämna det konkreta materialet, kan det fortsatta arbetet komma att vila på osäker grund"
132,1125,4,"Begreppsbildningen bör understödjas genom att ett klart och koncist språk används vid undervisningen, och när en matematisk terminologi införs, måste denna vara korrekt"
132,1126,1,Undervisningen i matematik skall utgå från elevernas erfarenheter och grundas på förståelse
132,1126,2,"Den skall efter hand ge förtrogenhet med några väsentliga matematiska begrepp och samband och bl a resultera i att eleverna uppnår god färdighet vid numerisk räkning, vilken innefattar användning av såväl elementära räknemetoder inom aritmetiken som räknesticka och tabeller"
132,1127,1,"Undervisningen skall vidare anknyta till elevernas erfarenheter på så sätt, att de får uppleva, hur matematiken används i det dagliga livet utanför skolan"
132,1127,2,Därför måste eleverna arbeta med problem av skilda slag
132,1127,3,"Problemen hämtas från elevernas erfarenhetsvärld, från matematikens praktiska tillämpningar och från den matematiska teorin samt utformas så, att de utvecklar elevernas förmåga att kombinera, ge uppslag och ta initiativ"
132,1128,1,"Vid inlärningen är det ofta ända138 | Matematik målsenligt, att man behandlar ett moment eller ett begrepp vid upprepade tillfällen"
132,1128,2,"Därvid skall behandlingen vara konkret så länge som detta krävs, för att eleven skall kunna tillägna sig de matematiska begreppen"
132,1128,3,Olikheterna mellan eleverna är i detta avseende mycket stora både i fråga om arbetssätt och arbetstakt
132,1128,4,Man bör exempelvis på ett tidigt stadium utnyttja elevernas intresse för lekar och enkla spel och låta dem göra egna erfarenheter som är värdefulla vid den senare begreppsbildningen
132,1128,5,"Man måste emellertid vara uppmärksam på att en framställning väljs och utförs så, att den inte motverkar en senare utvidgning och fördjupning"
132,1129,1,"När eleverna skall tillägna sig ett nytt begrepp, bygger de på konkreta upplevelser och erfarenheter samt på redan utvecklade begrepp"
132,1129,2,"Så kan t ex addition införas genom att eleverna utnyttjar dels konkreta situationer, varvid föremål ur två mängder sammanförs och bildar en mängd, dels talbegreppet"
132,1129,3,"Ju fler konkreta situationer man kan anknyta till och ju klarare redan förvärvade begrepp är, desto lättare sker den nya begreppsbildningen"
132,1129,4,Av denna anledning måste de grundläggande begreppen noga behandlas och olika konkreta situationer åstadkommas
132,1129,5,"Så ofta som möjligt bör behandlingen av nytt lärostoff utgå från verklighetsiakttagelser, manuellt arbete, mätningar och demonstrationer med hjälp av olika slag av material"
132,1129,6,Förklarande resonemang kan härigenom få en fastare förankring
132,1130,1,Vidare är det viktigt att inlärningstakten och den verbala framställningen blir lämpligt avpassade med hänsyn till elevernas individuella förutsättningar
132,1130,2,"Om detta inte beaktas vid undervisningen, kan följden bli, att eleverna når endast mekanisk färdighet utan att komma fram till verklig förståelse"
132,1130,3,"Under den fortsatta skolgången kan då kraven framstå som för höga, vilket i sin tur kan medföra ängslighet och olustkänslor"
132,1130,4,"Erfarenheter från undervisningen av barn med specifika matematiksvårigheter syns visa, att svårigheterna ibland beror på ängslan inför matematikstudiet"
132,1130,5,Man bör därför sträva efter att skapa en gynnsam känslomässig inställning hos eleverna
132,1131,1,För vissa elever uppstår stora inlärningssvårigheter i matematik
132,1131,2,"Det gäller framför allt elever med särskilda handikapp, exempelvis hörselskadade och intellektuellt utvecklingshämmade"
132,1131,3,Läs- och skrivsvårigheter kan vara förenade med språklig osäkerhet och bristfälliga förutsättningar för inlärning och kan därför leda till matematiksvårigheter
132,1131,4,Dessa på olika sätt handikappade kan vidare ha en mer begränsad erfarenhetsvärld
132,1131,5,Vid undervisningen kommer då konkretiserande läromedel att spela en särskilt viktig roll
132,1132,1,"Där samordnad specialundervisning anordnas, är det av betydelse, att den enskilde elevens förutsättningar och allmänna utgångsläge noggrant diagnostiseras och att arbetet planläggs med utgångspunkt häri"
132,1133,1,Lärostoff
132,1134,1,"Huvudmomenten anger de områden, det stoff och de färdigheter, som skall vara det väsentliga föremålet för undervisningen i ämnet"
132,1134,2,Dess huvudsakliga inriktning anges i ämnets mål och i anvisningarnas allmänna synpunkter
132,1135,1,"Eleverna bör tidigt göras uppmärksamma på de matematiska an""hängen delar av lärostoffet"
132,1135,2,Det gäller t ex sambanden mellan de fyra räknesätten 8 samt användning
132,1136,1,av geometriska metoder inom aritme——LAL tv
132,1137,1,» tik och algebra och omvänt
132,1137,2,Studiet underlättas om man försöker använda ett gemensamt språk inom olika områden
132,1137,3,Här kan begrepp ur mängdläran vara till hjälp
132,1137,4,"I den inledande undervisningen arbetar ""manmec mängder av v några få konkreta element, senare inom aritmetiken med ""mängder av tal, inom geometrin med mängder av punkter, inom funktionsTäran med mängder av par och inom sannolikhetsläran med mängder av utfall"
132,1137,5,Elementära begrepp och sym boler från mängdläran kan sålunda ge möjligheter att framställa stoffet enkelt och överskådligt och att påvisa sammanhanget mellan matemati***** PAGE 133 *****
132,1138,1,kens olika grenar
132,1138,2,Symbolspråket kan ibland ersätta tunga och oöverskådliga verbala formuleringar
132,1138,3,Man måste å andra sidan vara försiktig så att symbolerna inte upplevs som en belastning
132,1138,4,"De måste introduceras med stor omsorg och knytas till konkreta situationer, som eleverna upplever som naturliga"
132,1138,5,"Relations- och funktionsbegreppen, vektorer och vissa enkla algebraiska strukturer är andra hjälpmedel som kan öka elevernas möjligheter att bli förtrogna med det viktiga verktyg som matematiken utgör"
132,1139,1,"Vid valet av uppgifter i matematik bör största hänsyn tas till elevernas erfarenheter, behov och intressen"
132,1139,2,"Eftersom =matematikundervisningen skall fylla en praktisk uppgift, bör eleverna arbeta med sådana uppgifter, som man möter i hem, arbetsliv och samhälle"
132,1139,3,"Så ofta det är lämpligt, bör matematiska problem behandlas i sitt praktiska sammanhang"
132,1140,1,"Vid arbetet med tillämpningar bör räkning med närmevärden särskilt uppmärksammas, så att resultatet anges med en noggrannhet som är avpassad till noggrannheten hos givna data"
132,1140,2,"Eleverna bör också ibland få möta problem av mer öppen natur än de gängse, t ex situationer där det finns överflödiga data eller där vissa data saknas eller är motsägande"
132,1140,3,Man bör inte ägna ett omfattande arbete åt klassificering av problem i olika områden
132,1140,4,Det är mindre troligt att de i det senare fallet uppövade färdigheterna verkligen kommer till praktisk användning
132,1141,1,"Stor omsorg bör ägnas valet av uppgifter, så att svårighetsgraden väl avvägs med hänsyn till elevernas förutsättningar"
132,1141,2,"Särskilt på de lägre stadierna bör räkneövningarna i regel omfatta uppgifter, som inte fordrar långa och tidsödande räkneoperationer"
132,1142,1,Overslagsräkning kräver omfattande träning
132,1142,2,"Den bör sättas in redan tidigt på lågstadiet, så att eleven vänjer sig vid att regelbundet kontrollera att ett resultat är rimligt"
132,1142,3,"Vid räkning bör en avvägning ske mellan huvudräkning, nedskrivning av siffror och användning av algoritmer och uppställningar"
132,1142,4,"Eftersom man I samhället i allt större utsträckning använder maskinella hjälpmedel för numerisk räkning, bör skolan lägga stor vikt vid huvudräkning och överslagsräkning"
132,1143,1,Allmän och särskild kurs
132,1144,1,Den allmänna kursen på högstadiet skall tillgodose behovet av matematiska kunskaper och färdigheter i en allmän medborgerlig utbildning
132,1144,2,Eleverna skall bibehålla och allt efter sina förutsättningar utvidga de centrala kunskaper och färdigheter som de förvärvat under tidigare årskurser
132,1144,3,"Centrala moment är räkning med positiva tal i tiosystemet, grafisk framställning, procenträkning och tillämpningar av geometrin"
132,1144,4,"Räkning bör i första hand inriktas på tillvägagångssätt i vardagslivet, såsom överslagsräkning, huvudräkning och räkning ! med räknesticka"
132,1145,1,Läraren bör utgå från att flertalet elever som väljer allmän kurs är i behov av en konkret framställning av lärostoffet
132,1145,2,"Särskilt måste man uppmärksamma att såväl inledande exempel som övningar avpassas I svårighetsgrad, så att de matematiska metoderna ej skyms av tekniska svårigheter"
132,1145,3,"Man kan vidare anta att elever inom allmän kurs är 1 särskilt stort behov av täta repetitioner, inriktade på att förstärka begreppsbildningen"
132,1146,1,"Att framställningen görs konkret och övningarna lätta får inte innebära, att den allmänna kursen utarmas på matematiskt intressanta moment och därigenom framstår som en enformig upprepning av tidigare behandlade moment"
132,1146,2,Tvärtom är det angeläget att eleverna upplever stoffet som omväxlande och intressant
132,1147,1,Även bland elever som väljer den allmänna kursen kan skillnaderna i fråga om fallenhet för matematik vara påfallande stora
132,1147,2,"Läraren bör därför vara beredd att ge försigkomna elever mer krävande arbetsuppgifter och att låta dem få fördjupa sig i huvudmoment, som behandlas mera ingående i särskild kurs"
132,1147,3,:
132,1148,1,"Den särskilda kursen avser att, jämfört med den allmänna kursen, ge fördjupade kunskaper och färdigheter och en vidgad orientering om matematikens användningsområden"
132,1148,2,"Genom att lägga ökad vikt vid sådana moment, som ger en överblick över ämnet, tjänar den särskilda kursen också som förberedelse för fortsatta studier i matematik"
132,1149,1,"Undervisningen kan bedrivas så, att inom den särskilda kursen tilllämpningsproblemen väljs på en något högre abstraktionsnivå än i den allmänna kursen"
132,1149,2,"Det är också viktigt, att eleverna får tillfälle utvidga de kunskaper och färdigheter de förvärvat under tidigare årskurser"
132,1150,1,Om allmän och särskild kurs se även supplementet i matematik
132,1151,1,Planering och samverkan
132,1152,1,"För att matematikundervisningen skall ge ett gott resultat måste den grundas dels på en översiktlig planering av terminens eller läsårets arbete, dels på en planering av arbetet vid varje undervisningstillfälle"
132,1152,2,Vid planeringen måste beaktas att grundskolans undervisning utgör en helhet
132,1152,3,Sålunda bör inlärningen inriktas på elevens kunskaper och utveckling på längre sikt och inte på hans resultat vid slutet av årskursen
132,1153,1,"Under konferenser för undervisningens planering diskuteras dess Innehåll och uppläggning samt hur olika läromedel skall utnyttjas för att ge underlag för meningsfull, allsidig och självständig elevverksamhet"
132,1153,2,"Efter denna översiktliga planering vidtar lärarens planering för den egna klassen, varvid de enskilda elevernas speciella situation uppmärksammas"
132,1154,1,"Läraren bör göra klart för sig, hur de olika läromedlen kan utnyttjas för,"
132,1155,1,"”individualisering, så att varje elev kan erbjudas en studiegång som gvarar mot hans förutsättningar och"
132,1155,2,iptressen
132,1156,1,"""Vid behandling av stoff gemensamt med en större grupp elever, bör både lärostoff och arbetssätt vara omsorgsfullt genomtänkta och förberedda samt avpassade efter elevernas förutsättningar"
132,1156,2,Genomgångarna bör göras korta
132,1156,3,"Diskussioner i grupp bör disponeras så, att elevernas behov av såväl omväxling som arbetsro uppfylls"
132,1157,1,Matematik | 139
134,1158,1,Behovet av repetition måste uppmärksammas
134,1158,2,"Centrala moment bör återkomma flera gånger under läsåret, så att de ständigt hålls aktuella"
134,1158,3,Vidare bör man ägna tid åt förberedande behandling av många moment genom att t ex använda laborativa material
134,1158,4,"Den tid som på detta sätt används till begreppsbildning, minskar behovet av tid till färdighetsträning"
134,1159,1,En annan viktig planeringsuppgift gäller samverkan med andra ämnen
134,1159,2,"Man bör väl tillvarata de situationer, där matematik kan utnyttjas"
134,1159,3,"Matematikundervisningen kan hämta tillämpningar från undervisningen I övrigt, tex i Oorienteringsämnen, teckning, hemkunskap, slöjd, ekonomi och teknik"
134,1159,4,Läraren bör därför skaffa sig kännedom om hur eleverna kommer i kontakt med matematiska begrepp och tillämpningar av matematik I andra ämnen
134,1159,5,"Samverkan med andra ämnen kan också åstadkommas genom att både den sakligt orienterande och den matematiska behandlingen sker inom det andra ämnets ram, t ex genom att eleverna själva gör tabeller och diagram, utför medelvärdesberäkningar och på annat sätt bearbetar statistiska data"
134,1160,1,Arbetssätt
134,1161,1,Med hänsyn till elevernas mycket skiftande förutsättningar och behov är det nödvändigt att variera arbetssättet
134,1162,1,Genom hela grundskolan måste eleven tränas att arbeta självständigt med matematik
134,1162,2,"Detta arbete kan t ex innefatta handhavande av olika slag av konkretiserande material, textstudier, övningsräkning och problemlösning"
134,1162,3,"Till en början bör uppgifterna vara enkla och tidsmässigt begränsade, så småningom bör de bli mer omfattande"
